ID_ESTUDIOS,ESTATUS DE ESTUDIO,AÑO,ESTADOS,TITULO_ORIGINAL,TITULO_BUSQUEDA,EMPRESA,FUENTE,CONTRATO,EJEMPLARES,TOMOS,CARATULA,PDF,ESTADO_ARCHIVOS
1414,DIGITAL,1989,ZACATECAS,ACTUALIZACIÓN DE CONDICIONES PIEZOMÉTRICAS EN DIVERSAS ZONAS GEOHIDROLÓGICAS EN EL ESTADO DE ZACATECAS,ACTUALIZACIÓN DE CONDICIONES PIEZOMÉTRICAS EN DIVERSAS ZONAS GEOHIDROLÓGICAS EN EL ESTADO DE ZACATECAS,,COMISIÓN NACIONAL DEL AGUA (CONAGUA),PROYECTO B-ZAC-7/89,1,1,,https://sigagis.conagua.gob.mx/t_estudios24/INVENTARIO/32 ZACATECAS/PDF/1414_EC.pdf,ZACATECAS
1416,DIGITAL,1975,ZACATECAS,AMPLIACIÓN DEL ESTUDIO GEOHIDROLÓGICO PRELIMINAR EN LA ZONA DE VILLA HIDALGO EN EL ESTADO DE ZACATECAS,AMPLIACIÓN DEL ESTUDIO GEOHIDROLÓGICO PRELIMINAR EN LA ZONA DE VILLA HIDALGO EN EL ESTADO DE ZACATECAS,"CONSULTORES, SOCIEDAD ANÓNIMA",SECRETARÍA DE RECURSOS HIDRÁULICOS (SRH),IP-75-25,1,1,,https://sigagis.conagua.gob.mx/t_estudios24/INVENTARIO/32 ZACATECAS/PDF/1416_EC.pdf,ZACATECAS
1419,AMBOS,1980,ZACATECAS,ACTUALIZACIÓN DEL ESTUDIO GEOHIDROLÓGICO EN EL VALLE DE LORETO EN EL EDO. DE ZACATECAS,ACTUALIZACIÓN DEL ESTUDIO GEOHIDROLÓGICO EN EL VALLE DE LORETO EN EL EDO. DE ZACATECAS,CONSULTORES SOCIEDAD ANÓNIMA,SECRETARÍA DE AGRICULTURA Y RECURSOS HIDRÁULICOS (SARH),GZA-80-24-GD,1,2,,https://sigagis.conagua.gob.mx/t_estudios24/INVENTARIO/32 ZACATECAS/PDF/1419_EC.pdf,ZACATECAS
1420,DIGITAL,1989,ZACATECAS,"INFORME DE LOS SONDEOS ELÉCTRICOS VERTICALES REALIZADOS EN EL PROYECTO DENOMINADO ""LORETO"" EN EL MUNICIPIO DE LORETO, ESTADO DE ZACATECAS","INFORME DE LOS SONDEOS ELÉCTRICOS VERTICALES REALIZADOS EN EL PROYECTO DENOMINADO ""LORETO"" EN EL MUNICIPIO DE LORETO, ESTADO DE ZACATECAS",,SECRETARÍA DE AGRICULTURA Y RECURSOS HIDRÁULICOS (SARH),,1,1,,https://sigagis.conagua.gob.mx/t_estudios24/INVENTARIO/32 ZACATECAS/PDF/1420_EC.pdf,ZACATECAS
1421,AMBOS,1981,ZACATECAS,"ESTUDIO FOTOGEOLÓGICO EN LA ZONA DE VICTOR ROSALES, ESTADO DE ZACATECAS","ESTUDIO FOTOGEOLÓGICO EN LA ZONA DE VICTOR ROSALES, ESTADO DE ZACATECAS","INGEO, SOCIEDAD CIVIL",SECRETARÍA DE AGRICULTURA Y RECURSOS HIDRÁULICOS (SARH),GZA-81-157-FD,1,1,,https://sigagis.conagua.gob.mx/t_estudios24/INVENTARIO/32 ZACATECAS/PDF/1421_EC.pdf,ZACATECAS
1423,AMBOS,1981,ZACATECAS,"ESTUDIO GEOHIDROLÓGICO DEL VALLE DE JEREZ, EDO. DE ZACATECAS","ESTUDIO GEOHIDROLÓGICO DEL VALLE DE JEREZ, EDO. DE ZACATECAS","CONSULTORES, SOCIEDAD ANÓNIMA",SECRETARÍA DE AGRICULTURA Y RECURSOS HIDRÁULICOS (SARH),GZA-81-97 GD,1,1,,https://sigagis.conagua.gob.mx/t_estudios24/INVENTARIO/32 ZACATECAS/PDF/1423_EC.pdf,ZACATECAS
1425,AMBOS,1981,ZACATECAS,SERVICIOS DE PROSPECCIÓN Y LEVANTAMIENTOS GEOLÓGICOS Y GEOFÍSICOS EN LA REGIÓN DE SAIN ALTO EN EL ESTADO DE ZACATECAS,SERVICIOS DE PROSPECCIÓN Y LEVANTAMIENTOS GEOLÓGICOS Y GEOFÍSICOS EN LA REGIÓN DE SAIN ALTO EN EL ESTADO DE ZACATECAS,"TÉCNICOS ASESORES Y CONSTRUCTORES, SOCIEDAD ANÓNIMA (TACSA)",SECRETARÍA DE AGRICULTURA Y RECURSOS HIDRÁULICOS (SARH),GZA-81-31-ED,1,1,,https://sigagis.conagua.gob.mx/t_estudios24/INVENTARIO/32 ZACATECAS/PDF/1425_EC.pdf,ZACATECAS
1426,DIGITAL,2007,GUERRERO,"ESTUDIO PARA DETERMINAR LA POSICIÓN DE LA INTERFASE MARINA EN LA ZONA COSTERA DEL ACUÍFERO LA SABANA, GUERRERO","ESTUDIO PARA DETERMINAR LA POSICIÓN DE LA INTERFASE MARINA EN LA ZONA COSTERA DEL ACUÍFERO LA SABANA, GUERRERO",GEOPSA SOCIEDAD ANÓNIMA DE CAPITAL VARIABLE,,SGT-OCP-GRO-07-055-RF-I3,1,1,,https://sigagis.conagua.gob.mx/t_estudios24/INVENTARIO/12 GUERRERO/PDF/1426_EC.pdf,GUERRERO
1427,DIGITAL,1979,ZACATECAS,"SERVICIOS DE PROSPECCIÓN Y LEVANTAMIENTO GEOLÓGICOS Y GEOFÍSICOS EN LA ZONA DE VALPARAÍSO, ESTADO DE ZACATECAS","SERVICIOS DE PROSPECCIÓN Y LEVANTAMIENTO GEOLÓGICOS Y GEOFÍSICOS EN LA ZONA DE VALPARAÍSO, ESTADO DE ZACATECAS","SERVICIOS GEOLÓGICOS, SOCIEDAD ANÓNIMA",SECRETARÍA DE AGRICULTURA Y RECURSOS HIDRÁULICOS (SARH),EIGZA-79-14-ED,1,1,,https://sigagis.conagua.gob.mx/t_estudios24/INVENTARIO/32 ZACATECAS/PDF/1427_EC.pdf,ZACATECAS
1428,DIGITAL,1993,ZACATECAS,"INFORME TÉCNICO DE LA ZONA DE CALERA, ZAC.","INFORME TÉCNICO DE LA ZONA DE CALERA, ZAC.",,COMISIÓN NACIONAL DEL AGUA (CONAGUA),,1,1,,https://sigagis.conagua.gob.mx/t_estudios24/INVENTARIO/32 ZACATECAS/PDF/1428_EC.pdf,ZACATECAS
1429,DIGITAL,1989,ZACATECAS,PROSPECCIÓN GEOHIDROLÓGICA Y PERFORACIÓN EXPLORATORIA EN LA ZONA NORTE DEL ESTADO DE ZACATECAS (ZONA IXTLERA),PROSPECCIÓN GEOHIDROLÓGICA Y PERFORACIÓN EXPLORATORIA EN LA ZONA NORTE DEL ESTADO DE ZACATECAS (ZONA IXTLERA),,COMISIÓN NACIONAL DEL AGUA (CONAGUA),,1,1,,https://sigagis.conagua.gob.mx/t_estudios24/INVENTARIO/32 ZACATECAS/PDF/1429_EC.pdf,ZACATECAS
1431,DIGITAL,1986,ZACATECAS,"ESTUDIO GEOHIDROLÓGICO EL PALMAR, PERTENECIENTE A LOS MUNICIPIOS DE SOMBRERETE, RÍO GRANDE, JUAN ALDAMA, MIGUEL AUZA Y FRANCISCO R. MUNGUÍA (NUEVES), ZACATECAS","ESTUDIO GEOHIDROLÓGICO EL PALMAR, PERTENECIENTE A LOS MUNICIPIOS DE SOMBRERETE, RÍO GRANDE, JUAN ALDAMA, MIGUEL AUZA Y FRANCISCO R. MUNGUÍA (NUEVES), ZACATECAS",,SECRETARÍA DE AGRICULTURA Y RECURSOS HIDRÁULICOS (SARH),,1,1,,https://sigagis.conagua.gob.mx/t_estudios24/INVENTARIO/32 ZACATECAS/PDF/1431_EC.pdf,ZACATECAS
1432,AMBOS,1983,ZACATECAS,"ESTUDIO GEOHIDROLÓGICO DE LA ZONA ""LA BLANCA"", ESTADO DE ZACATECAS
TOMO 1","ESTUDIO GEOHIDROLÓGICO DE LA ZONA ""LA BLANCA"", ESTADO DE ZACATECAS
TOMO 1","BUFETE GEOLÓGICO Y CIENCIAS AFINES, SOCIEDAD ANÓNIMA",SECRETARÍA DE AGRICULTURA Y RECURSOS HIDRÁULICOS (SARH),OHIADR-E-83-39,1,1,,https://sigagis.conagua.gob.mx/t_estudios24/INVENTARIO/32 ZACATECAS/PDF/1432_EC.pdf,ZACATECAS
1435,AMBOS,1979,TAMAULIPAS,"PROSPECCIÓN Y LEVANTAMIENTOS GEOLÓGICOS Y GEOFÍSICOS EN EL ESTADO DE TAMAULIPAS
","PROSPECCIÓN Y LEVANTAMIENTOS GEOLÓGICOS Y GEOFÍSICOS EN EL ESTADO DE TAMAULIPAS
","INGENIEROS CIVILES Y GEÓLOGOS ASOCIADOS, SOCIEDAD ANÓNIMA",,GZA-79-61-ED,1,1,https://sigagis.conagua.gob.mx/t_estudios24/INVENTARIO/28 TAMAULIPAS/PDF/1435_CC.pdf,https://sigagis.conagua.gob.mx/t_estudios24/INVENTARIO/28 TAMAULIPAS/PDF/1435_EC.pdf,TAMAULIPAS
1436,DIGITAL,1970,GUANAJUATO,"ESTUDIO GEOHIDROLÓGICO PRELIMINAR DE LOS VALLES DE LEÓN Y RÍO TURBIO, GTO.","ESTUDIO GEOHIDROLÓGICO PRELIMINAR DE LOS VALLES DE LEÓN Y RÍO TURBIO, GTO.","ARIEL CONSTRUCCIONES, SOCIEDAD ANÓNIMA",SECRETARÍA DE RECURSOS HIDRÁULICOS (SRH),,1,1,,https://sigagis.conagua.gob.mx/t_estudios24/INVENTARIO/11 GUANAJUATO/PDF/1436_EC.pdf,GUANAJUATO
1437,DIGITAL,2003,GUERRERO,"EVALUACIÓN HIDROGEOLÓGICA DEL ACUÍFERO LA SABANA, GUERRERO.","EVALUACIÓN HIDROGEOLÓGICA DEL ACUÍFERO LA SABANA, GUERRERO.","PROYECTOS ANTARES, SOCIEDAD ANÓNIMA DE CAPITAL VARIABLE",,,1,1,,https://sigagis.conagua.gob.mx/t_estudios24/INVENTARIO/12 GUERRERO/PDF/1437_EC.pdf,GUERRERO
1442,DIGITAL,1992,GUANAJUATO,"DIAGNÓSTICO DE LAS CONDICIONES GEOHIDROLÓGICAS ACTUALES Y ALTERNATIVAS DE OPERACIÓN DEL ACUÍFERO: LA CUENCA ALTA DEL RÍO DE LA LAJA, ESTADO DE GUANAJUATO","DIAGNÓSTICO DE LAS CONDICIONES GEOHIDROLÓGICAS ACTUALES Y ALTERNATIVAS DE OPERACIÓN DEL ACUÍFERO: LA CUENCA ALTA DEL RÍO DE LA LAJA, ESTADO DE GUANAJUATO","CONSULTORES EN GEOLOGÍA, SOCIEDAD ANÓNIMA DE CAPITAL VARIABLE",COMISIÓN NACIONAL DEL AGUA (CONAGUA),CNA-GRLB-034/92 CHECAR,1,1,,https://sigagis.conagua.gob.mx/t_estudios24/INVENTARIO/11 GUANAJUATO/PDF/1442_EC.pdf,GUANAJUATO
1451,AMBOS,1984,HIDALGO,"ESTUDIO GEOHIDROLÓGICO CUANTITATIVO EN EL VALLE DE PACHUCA, HIDALGO","ESTUDIO GEOHIDROLÓGICO CUANTITATIVO EN EL VALLE DE PACHUCA, HIDALGO","CONSTRUCTORA GONZALEZ CALLES Y ASOCIADOS, SOCIEDAD ANÓNIMA DE CAPITAL VARIABLE",SECRETARÍA DE AGRICULTURA Y RECURSOS HIDRÁULICOS (SARH),AHGZA-83-18-EG,1,1,https://sigagis.conagua.gob.mx/t_estudios24/INVENTARIO/13 HIDALGO/PDF/1451_CC.pdf,https://sigagis.conagua.gob.mx/t_estudios24/INVENTARIO/13 HIDALGO/PDF/1451_EC.pdf,HIDALGO
1452,AMBOS,1991,HIDALGO,"ACTUALIZACIÓN GEOHIDROLÓGICA EN EL VALLE DE PACHUCA-TIZAYUCA, ESTADO DE HIDALGO","ACTUALIZACIÓN GEOHIDROLÓGICA EN EL VALLE DE PACHUCA-TIZAYUCA, ESTADO DE HIDALGO","THORSA, INGENIEROS CONSULTORES Y CONSTRUCTORES, SOCIEDAD ANÓNIMA DE CAPITAL VARIABLE",COMISIÓN NACIONAL DEL AGUA (CONAGUA),SGIHUI-90-378 D,1,1,,https://sigagis.conagua.gob.mx/t_estudios24/INVENTARIO/13 HIDALGO/PDF/1452_EC.pdf,HIDALGO
1455,DIGITAL,1987,ZACATECAS,"DICTAMEN DE SONDEOS ELECRICOS VERTICALES REALIZADOS EN EL ESTUDIO SUR ZACATECAS-GUADALUPE BAÑUELOS, MUNICIPIO DE GENARO CODINA, ESTADO DE ZACATECAS.","DICTAMEN DE SONDEOS ELECRICOS VERTICALES REALIZADOS EN EL ESTUDIO SUR ZACATECAS-GUADALUPE BAÑUELOS, MUNICIPIO DE GENARO CODINA, ESTADO DE ZACATECAS.",,SECRETARÍA DE AGRICULTURA Y RECURSOS HIDRÁULICOS (SARH),,,,,https://sigagis.conagua.gob.mx/t_estudios24/INVENTARIO/32 ZACATECAS/PDF/1455_EC.pdf,ZACATECAS
1458,DIGITAL,1978,SINALOA,ESTUDIO DE EVALUACIÓN DE ACUÍFEROS EN DIVERSAS ZONAS DEL ESTADO DE SINALOA. CUENCAS DE LOS RÍOS FUERTE Y SAN LORENZO,ESTUDIO DE EVALUACIÓN DE ACUÍFEROS EN DIVERSAS ZONAS DEL ESTADO DE SINALOA. CUENCAS DE LOS RÍOS FUERTE Y SAN LORENZO,,SECRETARÍA DE AGRICULTURA Y RECURSOS HIDRÁULICOS (SARH),GZA-78-33-G,1,1,https://sigagis.conagua.gob.mx/t_estudios24/INVENTARIO/25 SINALOA/PDF/1458_CC.pdf,https://sigagis.conagua.gob.mx/t_estudios24/INVENTARIO/25 SINALOA/PDF/1458_EC.pdf,SINALOA
1461,DIGITAL,1977,DURANGO,"ESTUDIO DE LOS RECURSOS ACUÍFEROS SUBTERRÁNEOS DE LA ZONA VILLA JUÁREZ, DGO.","ESTUDIO DE LOS RECURSOS ACUÍFEROS SUBTERRÁNEOS DE LA ZONA VILLA JUÁREZ, DURANGO","INGENIEROS CIVILES GEÓLOGOS ASOCIADOS, SOCIEDAD ANÓNIMA",SECRETARÍA DE ASENTAMIENTOS HUMANOS Y OBRAS PÚBLICAS (SAHOP),APA-514-77-DFA,1,1,,https://sigagis.conagua.gob.mx/t_estudios24/INVENTARIO/10 DURANGO/PDF/1461_EC.pdf,DURANGO
1464,AMBOS,1979,CHIAPAS,"ESTUDIO GEOHIDROLÓGICO DE FUENTES DE ABASTECIMIENTO DE AGUA POTABLE PARA PUERTO MADERO, CHIS.","ESTUDIO GEOHIDROLÓGICO DE FUENTES DE ABASTECIMIENTO DE AGUA POTABLE PARA PUERTO MADERO, ESTADO DE CHIAPAS","INGENIEROS CIVILES Y GEÓLOGOS ASOCIADOS, SOCIEDAD ANÓNIMA",SECRETARÍA DE ASENTAMIENTOS HUMANOS Y OBRAS PÚBLICAS (SAHOP),BIOU-08-00-012EC-79,1,1,https://sigagis.conagua.gob.mx/t_estudios24/INVENTARIO/07 CHIAPAS/PDF/1464_CC.pdf,https://sigagis.conagua.gob.mx/t_estudios24/INVENTARIO/07 CHIAPAS/PDF/1464_EC.pdf,CHIAPAS
1465,AMBOS,1979,CHIAPAS,"ESTUDIO GEOHIDROLÓGICO DE FUENTES DE ABASTECIMIENTO DE AGUA POTABLE PARA OCOZOCOAUTLA, CHIS.","ESTUDIO GEOHIDROLÓGICO DE FUENTES DE ABASTECIMIENTO DE AGUA POTABLE PARA OCOZOCOAUTLA, ESTADO DE CHIAPAS","INGENIEROS CIVILES Y GEÓLOGOS ASOCIADOS, SOCIEDAD ANÓNIMA",SECRETARÍA DE ASENTAMIENTOS HUMANOS Y OBRAS PÚBLICAS (SAHOP),BIOU-08-00-012EC-79,1,1,https://sigagis.conagua.gob.mx/t_estudios24/INVENTARIO/07 CHIAPAS/PDF/1465_CC.pdf,https://sigagis.conagua.gob.mx/t_estudios24/INVENTARIO/07 CHIAPAS/PDF/1465_EC.pdf,CHIAPAS
1474,DIGITAL,1978,CIUDAD DE MÉXICO,RELACIÓN DE CROQUIS DE LOCALIZACIÓN DE POZOS UBICADOS EN EL VALLE DE MÉXICO QUE TIENE A SU CARGO EL DEPARTAMENTO DEL DISTRITO FEDERAL,"RELACIÓN DE CROQUIS DE LOCALIZACIÓN DE POZOS UBICADOS EN EL VALLE DE MÉXICO QUE TIENE A SU CARGO EL DEPARTAMENTO DEL DISTRITO FEDERAL, CIUDAD DE MÉXICO, ACUÍFERO 0901 ZONA METROPOLITANA DE LA CIUDAD DE MÉXICO","PROYECTOS, ESTUDIOS Y SISTEMAS, SOCIEDAD ANÓNIMA DE CAPITAL VARIABLE",COMISIÓN NACIONAL DEL AGUA (CONAGUA),OAVM-DT-MEX-09-437-RF-LP,1,1,https://sigagis.conagua.gob.mx/t_estudios24/INVENTARIO/09 CIUDAD DE MÉXICO/PDF/1474_CC.pdf,https://sigagis.conagua.gob.mx/t_estudios24/INVENTARIO/09 CIUDAD DE MÉXICO/PDF/1474_EC.pdf,CIUDAD DE MÉXICO
1476,DIGITAL,1981,MICHOACÁN DE OCAMPO,"ESTUDIO GEOFÍSICO A BASE DE RESISTIVIDAD ELÉCTRICA A LO LARGO DEL TRAZO DE LA LÍNEA DE CONDUCCIÓN DEL ACUEDUCTO AL PUERTO INDUSTRIAL MARÍTIMO DE LÁZARO CARDENAS, MICH.","ESTUDIO GEOFÍSICO A BASE DE RESISTIVIDAD ELÉCTRICA A LO LARGO DEL TRAZO DE LA LÍNEA DE CONDUCCIÓN DEL ACUEDUCTO AL PUERTO INDUSTRIAL MARÍTIMO DE LÁZARO CARDENAS, MICH.","INGENIEROS CIVILES Y GEÓLOGOS ASOCIADOS, SOCIEDAD ANÓNIMA",SECRETARÍA DE AGRICULTURA Y RECURSOS HIDRÁULICOS (SARH),CC-81-199 D,1,1,,https://sigagis.conagua.gob.mx/t_estudios24/INVENTARIO/16 MICHOACÁN DE OCAMPO/PDF/1476_EC.pdf,MICHOACÁN DE OCAMPO
1491,DIGITAL,2010,QUERÉTARO,ESTUDIO DE EVALUACIÓN GEOHIDROLÓGICA DEL ACUÍFERO TOLIMÁN EN EL ESTADO DE QUERÉTARO. ,ESTUDIO DE EVALUACIÓN GEOHIDROLÓGICA DEL ACUÍFERO TOLIMÁN EN EL ESTADO DE QUERÉTARO. ,INSTITUTO TECNOLÓGICO SUPERIOR DE COSAMALOAPAN (ITSCO),COMISIÓN NACIONAL DEL AGUA (CONAGUA),CONVENIO CONAGUA/DLQRO/002/2010,1,1,,https://sigagis.conagua.gob.mx/t_estudios24/INVENTARIO/22 QUERÉTARO/PDF/1491_EC.pdf,QUERÉTARO
1492,DIGITAL,2010,QUERÉTARO,"ESTUDIO DE EVALUACIÓN GEOHIDROLÓGICA DEL ACUÍFERO VALLE DE AMEALCO EN EL ESTADO DE QUERÉTARO, CON 6 PLANOS. ","ESTUDIO DE EVALUACIÓN GEOHIDROLÓGICA DEL ACUÍFERO VALLE DE AMEALCO EN EL ESTADO DE QUERÉTARO, CON 6 PLANOS. ",INSTITUTO TECNOLÓGICO SUPERIOR DE COSAMALOAPAN (ITSCO),COMISIÓN NACIONAL DEL AGUA (CONAGUA),CONVENIO CONAGUA/DLQRO/002/2010,1,1,,https://sigagis.conagua.gob.mx/t_estudios24/INVENTARIO/22 QUERÉTARO/PDF/1492_EC.pdf,QUERÉTARO
1494,DIGITAL,2010,QUERÉTARO,"ESTUDIO DE EVALUACIÓN GEOHIDROLÓGICA DEL ACUÍFERO VALLE DE HUIMILPAN EN EL ESTADO DE QUERÉTARO, CON 6 PLANOS. ","ESTUDIO DE EVALUACIÓN GEOHIDROLÓGICA DEL ACUÍFERO VALLE DE HUIMILPAN EN EL ESTADO DE QUERÉTARO, CON 6 PLANOS. ",INSTITUTO TECNOLÓGICO SUPERIOR DE COSAMALOAPAN (ITSCO),COMISIÓN NACIONAL DEL AGUA (CONAGUA),CONVENIO CONAGUA/DLQRO/002/2010,1,1,,https://sigagis.conagua.gob.mx/t_estudios24/INVENTARIO/22 QUERÉTARO/PDF/1494_EC.pdf,QUERÉTARO
1495,AMBOS,2001,MÉXICO,"ESTUDIO DE EVALUACIÓN GEOHIDROLÓGICA EN EL ACUÍFERO DE TENANCINGO, ESTADO DE MÉXICO.
INFORME","ESTUDIO DE EVALUACIÓN GEOHIDROLÓGICA EN EL ACUÍFERO DE TENANCINGO, ESTADO DE MÉXICO.
INFORME","SIIMA SERVICIOS DE INGENIERÍA E INVESTIGACIÓN DEL MEDIO AMBIENTE, SOCIEDAD CIVIL",COMISIÓN NACIONAL DEL AGUA (CONAGUA),"SGT-GRB-MEX-01-023-RF-13
",,,,https://sigagis.conagua.gob.mx/t_estudios24/INVENTARIO/15 MÉXICO/PDF/1495_EC.pdf,MÉXICO
1497,DIGITAL,1986,MORELOS,"ESTUDIO DE EXPLORACIÓN GEOGRÁFICA EN LA ZONA DE XOXOCOTLA, MORELOS.
","ESTUDIO DE EXPLORACIÓN GEOGRÁFICA EN LA ZONA DE XOXOCOTLA, MORELOS.
","GEO PROYECTOS, SOCIEDAD ANÓNIMA",,,,,,https://sigagis.conagua.gob.mx/t_estudios24/INVENTARIO/17 MORELOS/PDF/1497_EC.pdf,MORELOS
1510,DIGITAL,1978,ZACATECAS,"ESTUDIO DE PROSPECCIÓN HIDROLÓGICA EN LA ZONA CALERA, ESTADO DE ZACATECAS","ESTUDIO DE PROSPECCIÓN HIDROLÓGICA EN LA ZONA CALERA, ESTADO DE ZACATECAS","ACUÍFEROS, SOCIEDAD ANÓNIMA",SECRETARÍA DE AGRICULTURA Y RECURSOS HIDRÁULICOS (SARH),O.H.A.D.R.1,,,,https://sigagis.conagua.gob.mx/t_estudios24/INVENTARIO/32 ZACATECAS/PDF/1510_EC.pdf,ZACATECAS
1512,DIGITAL,2023,ZACATECAS,"ESTUDIO HIDROGEOLÓGICO DEL ACUÍFERO 3209 JALPA-JUCHIPILA, ESTADO DE ZACATECAS.","ESTUDIO HIDROGEOLÓGICO DEL ACUÍFERO 3209 JALPA-JUCHIPILA, ESTADO DE ZACATECAS.",UNIVERSIDAD AUTÓNOMA DE ZACATECAS (UAZ),GOBIERNO DEL ESTADO DE ZACATECAS.,CONVENIO: SECAMPO-UAZ-DMA-001-2022,1,1,,https://sigagis.conagua.gob.mx/t_estudios24/INVENTARIO/32 ZACATECAS/PDF/1512_EC.pdf,ZACATECAS
1513,DIGITAL,1990,CHIHUAHUA,"ESTUDIO PARA EL CONTROL ADECUADO DE LAS AGUAS SUBTERRÁNEAS EN SU PROYECTO BISMARK EN ASCENSIÓN, CHIH. PRIMERA ETAPA","ESTUDIO PARA EL CONTROL ADECUADO DE LAS AGUAS SUBTERRÁNEAS EN SU PROYECTO BISMARK EN ASCENSIÓN, CHIHUAHUA PRIMERA ETAPA","INGENIEROS CIVILES Y GEÓLOGOS ASOCIADOS, SOCIEDAD ANÓNIMA","SERVICIOS INDUSTRIALES PEÑOLES, SOCIEDAD ANÓNIMA DE CAPITAL VARIABLE",,1,1,,https://sigagis.conagua.gob.mx/t_estudios24/INVENTARIO/08 CHIHUAHUA/PDF/1513_EC.pdf,CHIHUAHUA
1517,DIGITAL,1980,BAJA CALIFORNIA,ESTUDIO GEOHIDROLÓGICO DE CERRO PRIETO I,ESTUDIO GEOHIDROLÓGICO DE CERRO PRIETO I,,COMISIÓN FEDERAL DE ELECTRICIDAD (CFE),,1,1,,https://sigagis.conagua.gob.mx/t_estudios24/INVENTARIO/02 BAJA CALIFORNIA/PDF/1517_EC.pdf,BAJA CALIFORNIA
1526,AMBOS,2009,GUERRERO,"ACTUALIZACIÓN EVALUACIÓN GEOHIDROLÓGICA PARA DETERMINAR LA DISPONIBILIDAD DE LOS ACUÍFEROS LA UNIÓN, PETATLÁN Y TECPAN, EN EL ESTADO DE GUERRERO
TOMO 1: ACUÍFERO LA UNIÓN
TOMO 1: ACUÍFERO PETATLÁN
TOMO 2: ACUÍFERO TECPAN","EVALUACIÓN GEOHIDROLÓGICA PARA DETERMINAR LA DISPONIBILIDAD DE LOS ACUÍFEROS LA UNIÓN, PETATLÁN Y TECPAN, EN EL ESTADO DE GUERRERO
TOMO 1: ACUÍFERO LA UNIÓN
TOMO 1: ACUÍFERO PETATLÁN
TOMO 2: ACUÍFERO TECPAN
","BETSCO, SOCIEDAD ANÓNIMA DE CAPITAL VARIABLE",COMISIÓN NACIONAL DEL AGUA (CONAGUA),SGT-OCPS-GRO-09-025-RF-13,1,2,https://sigagis.conagua.gob.mx/t_estudios24/INVENTARIO/12 GUERRERO/PDF/1526_CC.pdf,,GUERRERO
1529,FÍSICO,1980,MORELOS,SERVICIOS DE PROSPECCIÓN Y LEVANTAMIENTOS GEOLÓGICOS Y GEOFÍSICOS EN VARIOS SITIOS DEL ESTADO DE MORELOS,SERVICIOS DE PROSPECCIÓN Y LEVANTAMIENTOS GEOLÓGICOS Y GEOFÍSICOS EN VARIOS SITIOS DEL ESTADO DE MORELOS,"CONSTRUCTORA PAREYA, SOCIEDAD ANÓNIMA",SECRETARÍA DE AGRICULTURA Y RECURSOS HIDRÁULICOS (SARH),,1,2,https://sigagis.conagua.gob.mx/t_estudios24/INVENTARIO/17 MORELOS/PDF/1529_CC.pdf,,MORELOS
1530,DIGITAL,1980,NUEVO LEÓN,"SERVICIOS DE PROSPECCIÓN Y LEVANTAMIENTOS GEOLÓGICOS Y GEOFÍSICOS EN LA ZONA DE CIÉNEGA DEL TORO, ESTADO DE NUEVO LEÓN.","SERVICIOS DE PROSPECCIÓN Y LEVANTAMIENTOS GEOLÓGICOS Y GEOFÍSICOS EN LA ZONA DE CIÉNEGA DEL TORO, ESTADO DE NUEVO LEÓN.","ESTUDIOS GEOTÉCNICOS, SOCIEDAD ANÓNIMA",SECRETARÍA DE AGRICULTURA Y RECURSOS HIDRÁULICOS (SARH),GZA-80-92-ED,1,1,,https://sigagis.conagua.gob.mx/t_estudios24/INVENTARIO/19 NUEVO LEÓN/PDF/1530_EC.pdf,NUEVO LEÓN
1531,DIGITAL,1981,MICHOACÁN DE OCAMPO,"SERVICIOS DE PROSPECCIÓN Y LEVANTAMIENTOS GEOLÓGICOS Y GEOFÍSICOS EN LA ZONA DE HIDALGO Y ZITÁCUARO, EN LA PARTE ORIENTAL DEL ESTADO DE MICHOACÁN","SERVICIOS DE PROSPECCIÓN Y LEVANTAMIENTOS GEOLÓGICOS Y GEOFÍSICOS EN LA ZONA DE HIDALGO Y ZITÁCUARO, EN LA PARTE ORIENTAL DEL ESTADO DE MICHOACÁN","INVESTIGACIONES TÉCNICAS DEL SUBSUELO, SOCIEDAD ANÓNIMA (ITS)",SECRETARÍA DE AGRICULTURA Y RECURSOS HIDRÁULICOS (SARH),GZA-81-37-ED,1,1,,https://sigagis.conagua.gob.mx/t_estudios24/INVENTARIO/16 MICHOACÁN DE OCAMPO/PDF/1531_EC.pdf,MICHOACÁN DE OCAMPO
1533,DIGITAL,1981,GUANAJUATO,"SERVICIOS DE PROSPECCIÓN Y LEVANTAMIENTOS GEOLÓGICOS Y GEOFÍSICOS EN LA ZONA DE OCAMPO-SAN FELIPE, EN LA PORCIÓN NORTE DEL EDO. DE GUANAJUATO","SERVICIOS DE PROSPECCIÓN Y LEVANTAMIENTOS GEOLÓGICOS Y GEOFÍSICOS EN LA ZONA DE OCAMPO-SAN FELIPE, EN LA PORCIÓN NORTE DEL EDO. DE GUANAJUATO","GEOHIDROLÓGICA MEXICANA, SOCIEDAD ANÓNIMA",SECRETARÍA DE AGRICULTURA Y RECURSOS HIDRÁULICOS (SARH),GZA-81-35-ED,1,1,,https://sigagis.conagua.gob.mx/t_estudios24/INVENTARIO/11 GUANAJUATO/PDF/1533_EC.pdf,GUANAJUATO
1534,DIGITAL,1997,AGUASCALIENTES,"DEFINICIÓN DEL FLUJO REGIONAL DEL AGUA SUBTERRÁNEA, SU POTENCIALIDAD Y USOS EN LA ZONA DE LA CD. DE AGUASCALIENTES, AGS.","DEFINICIÓN DEL FLUJO REGIONAL DEL AGUA SUBTERRÁNEA, SU POTENCIALIDAD Y USOS EN LA ZONA DE LA CIUDAD DE AGUASCALIENTES, ESTADO DE AGUASCALIENTES",UNIVERSIDAD NACIONAL AUTÓNOMA DE MÉXICO (UNAM),GOBIERNO DEL ESTADO DE AGUASCALIENTES,,1,1,https://sigagis.conagua.gob.mx/t_estudios24/INVENTARIO/01 AGUASCALIENTES/PDF/1534_CC.pdf,https://sigagis.conagua.gob.mx/t_estudios24/INVENTARIO/01 AGUASCALIENTES/PDF/1534_EC.pdf,AGUASCALIENTES
1537,DIGITAL,1986,GUANAJUATO,"ESTUDIOS DE EXPLORACIÓN GEOFÍSICA EN LA ZONA: OJUELOS, JAL Y OCAMPO, GTO.","ESTUDIOS DE EXPLORACIÓN GEOFÍSICA EN LA ZONA: OJUELOS, JAL Y OCAMPO, GUANAJUATO","GEOFÍSICA DE EXPLORACIONES GUYSA, SOCIEDAD ANÓNIMA DE CAPITAL VARIABLE",SECRETARÍA DE AGRICULTURA Y RECURSOS HIDRÁULICOS (SARH),ACSH-86-07-E,1,1,,https://sigagis.conagua.gob.mx/t_estudios24/INVENTARIO/11 GUANAJUATO/PDF/1537_EC.pdf,GUANAJUATO
1540,FÍSICO,1992,HIDALGO QUERÉTARO,"ESTUDIO DE PROSPECCIÓN GEOHIDROLÓGICA Y EXPLORACIÓN GEOFÍSICA EN LA ZONA DE TECOZAUTLA-VIZARRON, EDOS. DE HIDALGO Y QUERÉTARO","ESTUDIO DE PROSPECCIÓN GEOHIDROLÓGICA Y EXPLORACIÓN GEOFÍSICA EN LA ZONA DE TECOZAUTLA-VIZARRON, EDOS. DE HIDALGO Y QUERÉTARO","INGENIERÍA, GEOLOGÍA Y ARQUITECTURA DE MÉXICO, SOCIEDAD ANÓNIMA (IGAMSA)",COMISIÓN NACIONAL DEL AGUA (CONAGUA),SGAA-90-40,1,3,https://sigagis.conagua.gob.mx/t_estudios24/INVENTARIO/22 QUERÉTARO/PDF/1540_CC.pdf,,QUERÉTARO
1541,DIGITAL,2010,OAXACA,"PLAN DE MANEJO DEL ACUÍFERO VALLES CENTRALES, EN EL ESTADO DE OAXACA
TOMO I. PROCESO DE PLANEACIÓN
TOMO II. ANEXOS
TOMO III. PLAN DE MANEJO INTEGRADO","PLAN DE MANEJO DEL ACUÍFERO VALLES CENTRALES, EN EL ESTADO DE OAXACA
TOMO I. PROCESO DE PLANEACIÓN
TOMO II. ANEXOS
TOMO III. PLAN DE MANEJO INTEGRADO",UNIVERSIDAD AUTÓNOMA CHAPINGO (UACh),COMISIÓN NACIONAL DEL AGUA (CONAGUA),CONVENIO DE COLABORACIÓN SGT-OCPS-OAX-010-TT-001-RF-CC,,3,https://sigagis.conagua.gob.mx/t_estudios24/INVENTARIO/20 OAXACA/PDF/1541_CC.pdf,,OAXACA
1543,AMBOS,1981,NUEVO LEÓN,"SERVICIOS DE PROSPECCIÓN Y LEVANTAMIENTOS GEOLÓGICOS Y GEOFÍSICOS EN EL VALLE DE SANTA RITA-SANTA ANA-CRUZ DE ELORZA, ESTADO DE NUEVO LEÓN.","SERVICIOS DE PROSPECCIÓN Y LEVANTAMIENTOS GEOLÓGICOS Y GEOFÍSICOS EN EL VALLE DE SANTA RITA-SANTA ANA-CRUZ DE ELORZA, ESTADO DE NUEVO LEÓN.","SERVICIOS GEOLÓGICOS, SOCIEDAD ANÓNIMA",SECRETARÍA DE AGRICULTURA Y RECURSOS HIDRÁULICOS (SARH),GZA-81-18-ED,1,1,https://sigagis.conagua.gob.mx/t_estudios24/INVENTARIO/19 NUEVO LEÓN/PDF/1543_CC.pdf,https://sigagis.conagua.gob.mx/t_estudios24/INVENTARIO/19 NUEVO LEÓN/PDF/1543_EC.pdf,NUEVO LEÓN
1544,AMBOS,1986,SAN LUIS POTOSÍ,"ESTUDIO DE EXPLORACIÓN GEOFÍSICA EN LA ZONA DE VILLA DE ARRIAGA, S.L.P.","ESTUDIO DE EXPLORACIÓN GEOFÍSICA EN LA ZONA DE VILLA DE ARRIAGA, SAN LUIS POTOSÍ","EXPLORACIONES Y ESTUDIOS GEOLÓGICOS, GEOTÉCNICOS Y GEOHIDROLÓGICOS",SECRETARÍA DE AGRICULTURA Y RECURSOS HIDRÁULICOS (SARH),ACSH-86-04-E,1,1,https://sigagis.conagua.gob.mx/t_estudios24/INVENTARIO/24 SAN LUIS POTOSÍ/PDF/1544_CC.pdf,https://sigagis.conagua.gob.mx/t_estudios24/INVENTARIO/24 SAN LUIS POTOSÍ/PDF/1544_EC.pdf,SAN LUIS POTOSÍ
1545,DIGITAL,1981,PUEBLA,"SERVICIOS DE PROSPECCIÓN Y LEVANTAMIENTOS GEOLÓGICOS Y GEOFÍSICOS EN LA ZONA DE IXCAQUIXTLA-CHIGMECATITLAN, EN EL ESTADO DE PUEBLA","SERVICIOS DE PROSPECCIÓN Y LEVANTAMIENTOS GEOLÓGICOS Y GEOFÍSICOS EN LA ZONA DE IXCAQUIXTLA-CHIGMECATITLAN, EN EL ESTADO DE PUEBLA","PERFORACIONES Y ESTUDIOS GEOLÓGICOS, SOCIEDAD ANÓNIMA (PEGSA)",SECRETARÍA DE AGRICULTURA Y RECURSOS HIDRÁULICOS (SARH),GZA-81-40-ED,1,1,,https://sigagis.conagua.gob.mx/t_estudios24/INVENTARIO/21 PUEBLA/PDF/1546_EC.pdf,PUEBLA
1547,DIGITAL,1989,PUEBLA,"ESTUDIO DE EXPLORACIÓN GEOFÍSICA EN LA ZONA DE PUEBLA, PUE.","ESTUDIO DE EXPLORACIÓN GEOFÍSICA EN LA ZONA DE PUEBLA, PUE.","LESSER Y ASOCIADOS, SOCIEDAD ANÓNIMA DE CAPITAL VARIABLE",SECRETARÍA DE AGRICULTURA Y RECURSOS HIDRÁULICOS (SARH),SGAA-89-36,1,1,,https://sigagis.conagua.gob.mx/t_estudios24/INVENTARIO/21 PUEBLA/PDF/1547_EC.pdf,PUEBLA
1548,AMBOS,1981,SINALOA,"SONDEOS GEOFÍSICOS DE RESISTIVIDAD EN LAS ZONAS DE CULIACÁN Y LA CRUZ, ESTADO DE SINALOA.","SONDEOS GEOFÍSICOS DE RESISTIVIDAD EN LAS ZONAS DE CULIACÁN Y LA CRUZ, ESTADO DE SINALOA.","GEOFÍSICA DEL NOROESTE (GEA), SOCIEDAD ANÓNIMA DE CAPITAL VARIABLE",SECRETARÍA DE AGRICULTURA Y RECURSOS HIDRÁULICOS (SARH),GZA-81-170-ED,1,1,https://sigagis.conagua.gob.mx/t_estudios24/INVENTARIO/25 SINALOA/PDF/1548_CC.pdf,https://sigagis.conagua.gob.mx/t_estudios24/INVENTARIO/25 SINALOA/PDF/1548_EC.pdf,SINALOA
1549,AMBOS,1991,SAN LUIS POTOSÍ,PROSPECCIÓN GEOHIDROLÓGICA EN LAS ZONAS MARGINADAS DEL ESTADO DE SAN LUIS POTOSÍ,PROSPECCIÓN GEOHIDROLÓGICA EN LAS ZONAS MARGINADAS DEL ESTADO DE SAN LUIS POTOSÍ,"LESSER Y ASOCIADOS, SOCIEDAD ANÓNIMA DE CAPITAL VARIABLE",COMISIÓN NACIONAL DEL AGUA (CONAGUA),SGAA-90-35,1,1,https://sigagis.conagua.gob.mx/t_estudios24/INVENTARIO/24 SAN LUIS POTOSÍ/PDF/1549_CC.pdf,https://sigagis.conagua.gob.mx/t_estudios24/INVENTARIO/24 SAN LUIS POTOSÍ/PDF/1549_EC.pdf,SAN LUIS POTOSÍ
1552,DIGITAL,1981,VERACRUZ DE IGNACIO DE LA LLAVE,"PROSPECCIÓN GEOHIDROLÓGICA EN LA ZONA DE MARTÍNEZ DE LA TORRE Y NAUTLA, VER.","PROSPECCIÓN GEOHIDROLÓGICA EN LA ZONA DE MARTÍNEZ DE LA TORRE Y NAUTLA, VERACRUZ","ARIEL CONSTRUCCIONES, SOCIEDAD ANÓNIMA",SECRETARÍA DE AGRICULTURA Y RECURSOS HIDRÁULICOS (SARH),GZA-81-45-ED,1,1,,https://sigagis.conagua.gob.mx/t_estudios24/INVENTARIO/30 VERACRUZ DE IGNACIO DE LA LLAVE/PDF/1552_EC.pdf,VERACRUZ DE IGNACIO DE LA LLAVE
1553,AMBOS,1980,HIDALGO VERACRUZ DE IGNACIO DE LA LLAVE,"ESTUDIO DE LAS CONDICIONES GEOHIDROLÓGICAS EN LOS VALLES INTERMONTANOS DE LAS ZONAS DE HUEJUTLA, ATLAPEXCO Y HUAUTLA EN LOS EDOS. HIDALGO Y VERACRUZ","ESTUDIO DE LAS CONDICIONES GEOHIDROLÓGICAS EN LOS VALLES INTERMONTANOS DE LAS ZONAS DE HUEJUTLA, ATLAPEXCO Y HUAUTLA EN LOS EDOS. HIDALGO Y VERACRUZ","GEOCA, SOCIEDAD ANÓNIMA (GEÓLOGOS CONSULTORES ASOCIADOS S.A.)",,,1,1,https://sigagis.conagua.gob.mx/t_estudios24/INVENTARIO/30 VERACRUZ DE IGNACIO DE LA LLAVE/PDF/1553_CC.pdf,https://sigagis.conagua.gob.mx/t_estudios24/INVENTARIO/30 VERACRUZ DE IGNACIO DE LA LLAVE/PDF/1553_EC.pdf,VERACRUZ DE IGNACIO DE LA LLAVE
1554,AMBOS,1985,TAMAULIPAS,"ESTUDIO DE SERVICIOS DE PROSPECCIÓN GEOHIDROLÓGICA EN LA ZONA DE OCAMPO-ANTIGUO MORELOS, EN EL ESTADO DE TAMAULIPAS
","ESTUDIO DE SERVICIOS DE PROSPECCIÓN GEOHIDROLÓGICA EN LA ZONA DE OCAMPO-ANTIGUO MORELOS, EN EL ESTADO DE TAMAULIPAS
","ACUAPLAN, SOCIEDAD ANÓNIMA",SECRETARÍA DE AGRICULTURA Y RECURSOS HIDRÁULICOS (SARH),CRISH-85-16-E,1,1,https://sigagis.conagua.gob.mx/t_estudios24/INVENTARIO/28 TAMAULIPAS/PDF/1554_CC.pdf,https://sigagis.conagua.gob.mx/t_estudios24/INVENTARIO/28 TAMAULIPAS/PDF/1554_EC.pdf,TAMAULIPAS
