ID_ESTUDIOS,ESTATUS DE ESTUDIO,AÑO,ESTADOS,TITULO_ORIGINAL,TITULO_BUSQUEDA,EMPRESA,FUENTE,CONTRATO,EJEMPLARES,TOMOS,CARATULA,PDF,ESTADO_ARCHIVOS
1,DIGITAL,1971,AGUASCALIENTES,ESTUDIO HIDROGEOLÓGICO COMPLETO DE LOS ACUÍFEROS EN EL ESTADO DE AGUASCALIENTES.,ESTUDIO HIDROGEOLÓGICO COMPLETO DE LOS ACUÍFEROS EN EL ESTADO DE AGUASCALIENTES,"ARIEL CONSTRUCCIONES, SOCIEDAD ANÓNIMA",SECRETARÍA DE RECURSOS HIDRÁULICOS (SRH),,1,3,https://sigagis.conagua.gob.mx/t_estudios24/INVENTARIO/01 AGUASCALIENTES/PDF/0001_CC.pdf,https://sigagis.conagua.gob.mx/t_estudios24/INVENTARIO/01 AGUASCALIENTES/PDF/0001_EC.pdf,AGUASCALIENTES
2,AMBOS,1981,AGUASCALIENTES,"ACTUALIZACIÓN DEL ESTUDIO GEOHIDROLÓGICO EN LOS VALLES DE AGUASCALIENTES - CHICALOTE -CALVILLO Y VENADERO, EN EL ESTADO DE AGUASCALIENTES.","ACTUALIZACIÓN DEL ESTUDIO GEOHIDROLÓGICO EN LOS VALLES DE: 0101 VALLE DE AGUASCALIENTES, 0102 VALLE DE CHICALOTE, 0105 VALLE DE CALVILLO Y 0104 VENADERO, EN EL ESTADO DE AGUASCALIENTES","CONSULTORES, SOCIEDAD ANÓNIMA",SECRETARÍA DE AGRICULTURA Y RECURSOS HIDRÁULICOS (SARH),"GZA-80-IGD
GZA-81-100-GD",1,1,https://sigagis.conagua.gob.mx/t_estudios24/INVENTARIO/01 AGUASCALIENTES/PDF/0002_CC.pdf,https://sigagis.conagua.gob.mx/t_estudios24/INVENTARIO/01 AGUASCALIENTES/PDF/0002_EC.pdf,AGUASCALIENTES
3,AMBOS,2000,SONORA,DETERMINACIÓN DE LA DISPONIBILIDAD DE AGUA EN EL ACUÍFERO DE SAN PEDRO,DETERMINACIÓN DE LA DISPONIBILIDAD DE AGUA EN EL ACUÍFERO DE SAN PEDRO,INSTITUTO TECNOLÓGICO DE SONORA (ITSON),COMISIÓN NACIONAL DEL AGUA (CONAGUA),,1,1,https://sigagis.conagua.gob.mx/t_estudios24/INVENTARIO/26 SONORA/PDF/0003_CC.pdf,https://sigagis.conagua.gob.mx/t_estudios24/INVENTARIO/26 SONORA/PDF/0003_EC.pdf,SONORA
5,DIGITAL,1977,AGUASCALIENTES,PROSPECCIÓN Y LEVANTAMIENTOS GEOLÓGICOS Y GEOFÍSICOS EN EL ESTADO DE AGUASCALIENTES.,PROSPECCIÓN Y LEVANTAMIENTOS GEOLÓGICOS Y GEOFÍSICOS EN EL ESTADO DE AGUASCALIENTES.,"CONSULTEC INGENIEROS ASOCIADOS, SOCIEDAD CIVIL",SECRETARÍA DE AGRICULTURA Y RECURSOS HIDRÁULICOS (SARH),GZA-77-18E,1,1,https://sigagis.conagua.gob.mx/t_estudios24/INVENTARIO/01 AGUASCALIENTES/PDF/0005_CC.pdf,https://sigagis.conagua.gob.mx/t_estudios24/INVENTARIO/01 AGUASCALIENTES/PDF/0005_EC.pdf,AGUASCALIENTES
7,FÍSICO,1994,TAMAULIPAS,"CARACTERIZACIÓN GEOHIDROLÓGICA DEL ESTADO DE TAMAULIPAS
","CARACTERIZACIÓN GEOHIDROLÓGICA DEL ESTADO DE TAMAULIPAS
","PECTEN, SOCIEDAD ANÓNIMA DE CAPITAL VARIABLE",COMISIÓN NACIONAL DEL AGUA (CONAGUA),,1,1,https://sigagis.conagua.gob.mx/t_estudios24/INVENTARIO/28 TAMAULIPAS/PDF/0007_CC.pdf,,TAMAULIPAS
8,DIGITAL,1981,AGUASCALIENTES,"ESTUDIO GEOHIDROLÓGICO DE LOS VALLES DE AGUASCALIENTES, CHICALOTE Y CALVILLO, EN EL EDO. DE AGUASCALIENTES.","ESTUDIO GEOHIDROLÓGICO DE LOS VALLES DE: 0101 VALLE DE AGUASCALIENTES, 0102 VALLE DE CHICALOTE Y 0105 VALLE DE CALVILLO, EN EL EDO. DE AGUASCALIENTES.","CONSULTORES, SOCIEDAD ANÓNIMA",SECRETARÍA DE AGRICULTURA Y RECURSOS HIDRÁULICOS (SARH),GZA-80-I GD,1,1,https://sigagis.conagua.gob.mx/t_estudios24/INVENTARIO/01 AGUASCALIENTES/PDF/0008_CC.pdf,https://sigagis.conagua.gob.mx/t_estudios24/INVENTARIO/01 AGUASCALIENTES/PDF/0008_EC.pdf,AGUASCALIENTES
9,AMBOS,1986,AGUASCALIENTES,SINOPSIS GEOHIDROLÓGICA DEL ESTADO DE AGUASCALIENTES.,SINOPSIS GEOHIDROLÓGICA DEL ESTADO DE AGUASCALIENTES.,SECRETARÍA DE AGRICULTURA Y RECURSOS HIDRÁULICOS (SARH),SECRETARÍA DE AGRICULTURA Y RECURSOS HIDRÁULICOS (SARH),,1,1,https://sigagis.conagua.gob.mx/t_estudios24/INVENTARIO/01 AGUASCALIENTES/PDF/0009_CC.pdf,https://sigagis.conagua.gob.mx/t_estudios24/INVENTARIO/01 AGUASCALIENTES/PDF/0009_EC.pdf,AGUASCALIENTES
10,DIGITAL,1974,AGUASCALIENTES,"ESTUDIO GEOFÍSICO EN LA ZONA DE CALVILLO, ESTADO DE AGUASCALIENTES.","ESTUDIO GEOFÍSICO EN LA ZONA DE 0105 VALLE DE CALVILLO, ESTADO DE AGUASCALIENTES.","GEOFIMEX, SOCIEDAD ANÓNIMA","GEOFIMEX, SOCIEDAD ANÓNIMA",EIGZA-74-4,1,1,https://sigagis.conagua.gob.mx/t_estudios24/INVENTARIO/01 AGUASCALIENTES/PDF/0010_CC.pdf,https://sigagis.conagua.gob.mx/t_estudios24/INVENTARIO/01 AGUASCALIENTES/PDF/0010_EC.pdf,AGUASCALIENTES
11,AMBOS,2007,TAMAULIPAS,"ACTUALIZACIÓN DE MEDICIONES PIEZOMÉTRICAS EN EL ACUÍFERO 2804 SAN CARLOS, ESTADO DE TAMAULIPAS
","ACTUALIZACIÓN DE MEDICIONES PIEZOMÉTRICAS EN EL ACUÍFERO 2804 SAN CARLOS, ESTADO DE TAMAULIPAS
",DSK TECHNOLOGIES SOCIEDAD ANÓNIMA DE CAPITAL VARIABLE,COMISIÓN NACIONAL DEL AGUA (CONAGUA),SGT-OCGN-TA-1-07-032-RF-LP,1,1,https://sigagis.conagua.gob.mx/t_estudios24/INVENTARIO/28 TAMAULIPAS/PDF/0011_CC.pdf,https://sigagis.conagua.gob.mx/t_estudios24/INVENTARIO/28 TAMAULIPAS/PDF/0011_EC.pdf,TAMAULIPAS
12,DIGITAL,1983,AGUASCALIENTES,"ESTUDIO GEOHIDROLÓGICO EN AGUASCALIENTES, AGTS.
TOMO 1: ESTUDIO DE EVALUACIÓN GEOHIDROLÓGICA A NIVEL PRELIMINAR DE LA PORCIÓN NORTE DE LA PLANICIE DEL LLANO
TOMO 2: ESTUDIO GEOHIDROLÓGICO DE LA ZONA SUR DEL VALLE DE AGUASCALIENTES.","ESTUDIO GEOHIDROLÓGICO EN AGUASCALIENTES, ESTADO DE AGUASCALIENTES
TOMO 1: ESTUDIO DE EVALUACIÓN GEOHIDROLÓGICA A NIVEL PRELIMINAR DE LA PORCIÓN NORTE DE LA PLANICIE DEL LLANO
TOMO 2: ESTUDIO GEOHIDROLÓGICO DE LA ZONA SUR DEL VALLE DE AGUASCALIENTES.","PROYECTOS DE INGENIERÍA Y CONSTRUCCIÓN, SOCIEDAD ANÓNIMA",SECRETARÍA DE ASENTAMIENTOS HUMANOS Y OBRAS PÚBLICAS,82-A-DC-A-001-Y-0-2,1,2,https://sigagis.conagua.gob.mx/t_estudios24/INVENTARIO/01 AGUASCALIENTES/PDF/0012_CC.pdf,https://sigagis.conagua.gob.mx/t_estudios24/INVENTARIO/01 AGUASCALIENTES/PDF/0012_EC.pdf,AGUASCALIENTES
13,DIGITAL,1979,AGUASCALIENTES,ESTUDIOS GEOFÍSICOS EN DIVERSAS ZONAS DEL ESTADO DE AGUASCALIENTES.,ESTUDIOS GEOFÍSICOS EN DIVERSAS ZONAS DEL ESTADO DE AGUASCALIENTES.,"INVESTIGACIONES TÉCNICAS DEL SUBSUELO, SOCIEDAD ANÓNIMA (ITS)",SECRETARÍA DE RECURSOS HIDRÁULICOS (SRH),GZA-79-23-GD,1,1,https://sigagis.conagua.gob.mx/t_estudios24/INVENTARIO/01 AGUASCALIENTES/PDF/0013_CC.pdf,https://sigagis.conagua.gob.mx/t_estudios24/INVENTARIO/01 AGUASCALIENTES/PDF/0013_EC.pdf,AGUASCALIENTES
14,AMBOS,1991,AGUASCALIENTES ZACATECAS,"MODELO MATEMÁTICO DEL ACUÍFERO DE LOS VALLES OJOCALIENTE, ZAC. Y AGUASCALIENTES","MODELO MATEMÁTICO DEL ACUÍFERO DE LOS VALLES OJOCALIENTE, ESTADOS DE ZACATECAS Y AGUASCALIENTES",COMISIÓN NACIONAL DEL AGUA (CONAGUA),COMISIÓN NACIONAL DEL AGUA (CONAGUA),,1,1,https://sigagis.conagua.gob.mx/t_estudios24/INVENTARIO/01 AGUASCALIENTES/PDF/0014_CC.pdf,https://sigagis.conagua.gob.mx/t_estudios24/INVENTARIO/01 AGUASCALIENTES/PDF/0014_EC.pdf,AGUASCALIENTES
15,DIGITAL,1963,AGUASCALIENTES,ESTUDIO GEOHIDROLÓGICO DEL ESTADO DE AGUASCALIENTES,ESTUDIO GEOHIDROLÓGICO DEL ESTADO DE AGUASCALIENTES,"TÉCNICOS ASESORES Y CONSTRUCTORES, SOCIEDAD ANÓNIMA (TACSA)",SECRETARÍA DE RECURSOS HIDRÁULICOS (SRH),SGAA-90-32,1,1,https://sigagis.conagua.gob.mx/t_estudios24/INVENTARIO/01 AGUASCALIENTES/PDF/0015_CC.pdf,https://sigagis.conagua.gob.mx/t_estudios24/INVENTARIO/01 AGUASCALIENTES/PDF/0015_EC.pdf,AGUASCALIENTES
17,DIGITAL,1987,VERACRUZ DE IGNACIO DE LA LLAVE,INFORME DE PROSPECCIÓN GEOHIDROLÓGICA Y PERFORACIÓN EXPLORATORIA EN LA PORCIÓN CENTRAL DEL ESTADO DE VERACRUZ,INFORME DE PROSPECCIÓN GEOHIDROLÓGICA Y PERFORACIÓN EXPLORATORIA EN LA PORCIÓN CENTRAL DEL ESTADO DE VERACRUZ,,SECRETARÍA DE AGRICULTURA Y RECURSOS HIDRÁULICOS (SARH),,1,1,,https://sigagis.conagua.gob.mx/t_estudios24/INVENTARIO/30 VERACRUZ DE IGNACIO DE LA LLAVE/PDF/0017_EC.pdf,VERACRUZ DE IGNACIO DE LA LLAVE
18,DIGITAL,2020,CIUDAD DE MÉXICO,ESTUDIO HIDROGEOLÓGICO DE ZONAS DE RECARGA ACUÍFERA PARA EL ABASTECIMIENTO DE AGUA A LA CIUDAD DE MÉXICO,ESTUDIO HIDROGEOLÓGICO DE ZONAS DE RECARGA ACUÍFERA PARA EL ABASTECIMIENTO DE AGUA A LA CIUDAD DE MÉXICO,"ESTUDIOS Y PROYECTOS MORO, SOCIEDAD ANÓNIMA","THE NATURE CONSERVANCY A LA EMPRESA MORO INGENIERÍA, SOCIEDAD CIVIL",C-MX-060619MORO,1,1,https://sigagis.conagua.gob.mx/t_estudios24/INVENTARIO/09 CIUDAD DE MÉXICO/PDF/0018_CC.pdf,https://sigagis.conagua.gob.mx/t_estudios24/INVENTARIO/09 CIUDAD DE MÉXICO/PDF/0018_EC.pdf,CIUDAD DE MÉXICO
19,AMBOS,2006,TAMAULIPAS,"ESTUDIO DE ACTUALIZACIÓN DE MEDICIONES PIEZOMÉTRICAS EN EL ACUÍFERO VICTORIA CASAS, EN EL ESTADO DE TAMAULIPAS
","ESTUDIO DE ACTUALIZACIÓN DE MEDICIONES PIEZOMÉTRICAS EN EL ACUÍFERO VICTORIA CASAS, EN EL ESTADO DE TAMAULIPAS
","GEOFÍSICA Y PERFORACIONES DEL MEDIO AMBIENTE, SOCIEDAD CIVIL",COMISIÓN NACIONAL DEL AGUA (CONAGUA),SGT-GN-TAM-06-34-RF-LP,1,1,https://sigagis.conagua.gob.mx/t_estudios24/INVENTARIO/28 TAMAULIPAS/PDF/0019_CC.pdf,https://sigagis.conagua.gob.mx/t_estudios24/INVENTARIO/28 TAMAULIPAS/PDF/0019_EC.pdf,TAMAULIPAS
20,DIGITAL,1971,BAJA CALIFORNIA,"ESTUDIO DE ALTERNATIVAS DE EXPLOTACIÓN FUTURA DE AGUAS SUBTERRÁNEAS EN VALLE DE MEXICALI Y MESA DE SAN LUIS, MÉXICO Y YUMA E.U.A.","ESTUDIO DE ALTERNATIVAS DE EXPLOTACIÓN FUTURA DE AGUAS SUBTERRÁNEAS EN VALLE DE MEXICALI Y MESA DE SAN LUIS, MÉXICO Y YUMA ESTADOS UNIDOS DE AMÉRICA",,SECRETARÍA DE RECURSOS HIDRÁULICOS (SRH),,1,1,,https://sigagis.conagua.gob.mx/t_estudios24/INVENTARIO/02 BAJA CALIFORNIA/PDF/0020_EC.pdf,BAJA CALIFORNIA
21,AMBOS,2000,SONORA,"DETERMINACIÓN DE LA DISPONIBILIDAD DE AGUA EN EL ACUÍFERO CABORCA, ESTADO DE SONORA","DETERMINACIÓN DE LA DISPONIBILIDAD DE AGUA EN EL ACUÍFERO CABORCA, ESTADO DE SONORA",INSTITUTO TECNOLÓGICO DE SONORA (ITSON),COMISIÓN NACIONAL DEL AGUA (CONAGUA),,1,1,https://sigagis.conagua.gob.mx/t_estudios24/INVENTARIO/26 SONORA/PDF/0021_CC.pdf,https://sigagis.conagua.gob.mx/t_estudios24/INVENTARIO/26 SONORA/PDF/0021_EC.pdf,SONORA
22,FÍSICO,2008,SONORA,"ESTUDIO DE ACTUALIZACIÓN DE LA DISPONIBILIDAD DE AGUA EN EL ACUÍFERO 2632, RÍO FRONTERA, ESTADO DE SONORA, MÉXICO","ESTUDIO DE ACTUALIZACIÓN DE LA DISPONIBILIDAD DE AGUA EN EL ACUÍFERO 2632, RÍO FRONTERA, ESTADO DE SONORA, MÉXICO",CONSULTORES: GEÓL. MARIANO MORALES M. E ING. RUBÉN MARTÍNEZ G.,COMISIÓN NACIONAL DEL AGUA (CONAGUA),,,,https://sigagis.conagua.gob.mx/t_estudios24/INVENTARIO/26 SONORA/PDF/0022_CC.pdf,,SONORA
23,DIGITAL,1975,BAJA CALIFORNIA,"SERVICIOS DE PROSPECCIÓN Y LEVANTAMIENTOS GEOLÓGICOS Y GEOFÍSICOS EN EL VALLE DE LA MISIÓN, ESTADO DE BAJA CALIFORNIA NORTE","SERVICIOS DE PROSPECCIÓN Y LEVANTAMIENTOS GEOLÓGICOS Y GEOFÍSICOS EN EL VALLE DE LA MISIÓN, ESTADO DE BAJA CALIFORNIA NORTE","TÉCNICAS MODERNAS DE INGENIERÍA, SOCIEDAD ANÓNIMA",SECRETARÍA DE RECURSOS HIDRÁULICOS (SRH),EIGZA-75-10,1,1,,https://sigagis.conagua.gob.mx/t_estudios24/INVENTARIO/02 BAJA CALIFORNIA/PDF/0023_EC.pdf,BAJA CALIFORNIA
24,DIGITAL,1970,GUANAJUATO,"INFORME PRELIMINAR DEL ESTUDIO GEOHIDROLÓGICO DE LA ZONA DE SAN LUIS DE LA PAZ Y DR. MORA, GTO.","INFORME PRELIMINAR DEL ESTUDIO GEOHIDROLÓGICO DE LA ZONA DE SAN LUIS DE LA PAZ Y DR. MORA, GUANAJUATO","HIDROTEC, SOCIEDAD ANÓNIMA",SECRETARÍA DE RECURSOS HIDRÁULICOS (SRH),,1,2,,https://sigagis.conagua.gob.mx/t_estudios24/INVENTARIO/11 GUANAJUATO/PDF/0024_EC.pdf,GUANAJUATO
25,DIGITAL,2007,COLIMA,"ESTUDIO DE ACTUALIZACIÓN HIDROGEOLÓGICA DE LOS ACUÍFEROS ""ARMERÍA-TECOMÁN-PERIQUILLOS"" Y ""VALLE DE IXTLAHUACÁN"", ESTADO DE COLIMA","ESTUDIO DE ACTUALIZACIÓN HIDROGEOLÓGICA DE LOS ACUÍFEROS ""ARMERÍA-TECOMÁN-PERIQUILLOS"" Y ""VALLE DE IXTLAHUACÁN"", ESTADO DE COLIMA",SERVICIO GEOLÓGICO MEXICANO (SGM),SECRETARÍA DE ECONOMÍA (SE),,1,1,https://sigagis.conagua.gob.mx/t_estudios24/INVENTARIO/06 COLIMA/PDF/0025_CC.pdf,https://sigagis.conagua.gob.mx/t_estudios24/INVENTARIO/06 COLIMA/PDF/0025_EC.pdf,COLIMA
26,AMBOS,1974,BAJA CALIFORNIA,"INFORME DEL ""ESTUDIO GEOHIDROLÓGICO DEL VALLE SAN TELMO, EDO. DE BAJA CALIFORNIA""","INFORME DEL ""ESTUDIO GEOHIDROLÓGICO DEL VALLE SAN TELMO, EDO. DE BAJA CALIFORNIA""","TÉCNICAS MODERNAS DE INGENIERÍA, SOCIEDAD ANÓNIMA",SECRETARÍA DE RECURSOS HIDRÁULICOS (SRH),EIGZA-74-23,1,1,,https://sigagis.conagua.gob.mx/t_estudios24/INVENTARIO/02 BAJA CALIFORNIA/PDF/0026_EC.pdf,BAJA CALIFORNIA
28,DIGITAL,1998,QUINTANA ROO,INFORME ANÁLISIS RESULTADOS FÍSICO-QUÍMICOS DEL AGUA PIEZOMETRÍA,INFORME ANÁLISIS RESULTADOS FÍSICO-QUÍMICOS DEL AGUA PIEZOMETRÍA,,COMISIÓN NACIONAL DEL AGUA (CONAGUA),,,,,https://sigagis.conagua.gob.mx/t_estudios24/INVENTARIO/23 QUINTANA ROO/PDF/0028_EC.pdf,QUINTANA ROO
29,DIGITAL,1974,BAJA CALIFORNIA,ESTUDIO GEOHIDROLÓGICO DE LOS VALLES DE OJOS NEGROS Y REAL DEL CASTILLO EN EL ESTADO DE BAJA CALIFORNIA NORTE,ESTUDIO GEOHIDROLÓGICO DE LOS VALLES DE OJOS NEGROS Y REAL DEL CASTILLO EN EL ESTADO DE BAJA CALIFORNIA NORTE,"TÉCNICAS MODERNAS DE INGENIERÍA, SOCIEDAD ANÓNIMA",SECRETARÍA DE RECURSOS HIDRÁULICOS (SRH),EIGZA-74-23,1,1,,https://sigagis.conagua.gob.mx/t_estudios24/INVENTARIO/02 BAJA CALIFORNIA/PDF/0029_EC.pdf,BAJA CALIFORNIA
30,FÍSICO,2005,SINALOA,"INFORME DE LA SEGUNDA CORRIDA DE PIEZOMETRÍA E HIDROMETRÍA REALIZADA DURANTE EL PERIODO: NOVIEMBRE-DICIEMBRE DE 2005, EN LOS ACUÍFEROS DE LOS RÍOS: FUERTE, SINALOA, MOCORITO, CULIACÁN, SAN LORENZO ELOTA, PIAXTLA, QUELITE, PRESIDIO, BALUARTE, CAÑAS, VALLE DE ESCUINAPA Y LAGUNA AGUA GRANDE (BARRA DE TEACAPÁN), SINALOA","INFORME DE LA SEGUNDA CORRIDA DE PIEZOMETRÍA E HIDROMETRÍA REALIZADA DURANTE EL PERIODO: NOVIEMBRE-DICIEMBRE DE 2005, EN LOS ACUÍFEROS DE LOS RÍOS: FUERTE, SINALOA, MOCORITO, CULIACÁN, SAN LORENZO ELOTA, PIAXTLA, QUELITE, PRESIDIO, BALUARTE, CAÑAS, VALLE DE ESCUINAPA Y LAGUNA AGUA GRANDE (BARRA DE TEACAPÁN), SINALOA",,COMISIÓN NACIONAL DEL AGUA (CONAGUA),,1,1,https://sigagis.conagua.gob.mx/t_estudios24/INVENTARIO/25 SINALOA/PDF/0030_CC.pdf,,SINALOA
31,DIGITAL,1973,BAJA CALIFORNIA,"GEOLOGÍA, GEOFÍSICA Y GEOQUÍMICA DEL VALLES DEL ROSARIO EN EL ESTADO DE BAJA CALIFORNIA","GEOLOGÍA, GEOFÍSICA Y GEOQUÍMICA DEL VALLES DEL ROSARIO EN EL ESTADO DE BAJA CALIFORNIA","GEOFIMEX, SOCIEDAD ANÓNIMA",SECRETARÍA DE RECURSOS HIDRÁULICOS (SRH),EIGZA-73-1,1,1,,https://sigagis.conagua.gob.mx/t_estudios24/INVENTARIO/02 BAJA CALIFORNIA/PDF/0031_EC.pdf,BAJA CALIFORNIA
32,DIGITAL,1977,BAJA CALIFORNIA,ESTUDIO GEOHIDROLÓGICO DE EVALUACIÓN Y CENSO EN LOS ESTADOS DE BAJA CALIFORNIA Y SUR (VALLE DE SAN VICENTE),ESTUDIO GEOHIDROLÓGICO DE EVALUACIÓN Y CENSO EN LOS ESTADOS DE BAJA CALIFORNIA Y SUR (VALLE DE SAN VICENTE),"TÉCNICAS MODERNAS DE INGENIERÍA, SOCIEDAD ANÓNIMA",SECRETARÍA DE AGRICULTURA Y RECURSOS HIDRÁULICOS (SARH),EIGZA-77-66,1,1,,https://sigagis.conagua.gob.mx/t_estudios24/INVENTARIO/02 BAJA CALIFORNIA/PDF/0032_EC.pdf,BAJA CALIFORNIA
33,AMBOS,1976,BAJA CALIFORNIA,ESTUDIO GEOHIDROLÓGICO EN DIVERSOS VALLES EN EL ESTADO DE BAJA CALIFORNIA NORTE,ESTUDIO GEOHIDROLÓGICO EN DIVERSOS VALLES EN EL ESTADO DE BAJA CALIFORNIA NORTE,"TÉCNICAS MODERNAS DE INGENIERÍA, SOCIEDAD ANÓNIMA",SECRETARÍA DE RECURSOS HIDRÁULICOS (SRH),EIGZA-76-3,1,1,,https://sigagis.conagua.gob.mx/t_estudios24/INVENTARIO/02 BAJA CALIFORNIA/PDF/0033_EC.pdf,BAJA CALIFORNIA
34,DIGITAL,1977,BAJA CALIFORNIA,"INFORME DEL ""ESTUDIO HIDROGEOLÓGICO DE PROSPECCIÓN VALLE DE JAMAU, ESTADO DE BAJA CALIFORNIA NORTE""","INFORME DEL ""ESTUDIO HIDROGEOLÓGICO DE PROSPECCIÓN VALLE DE JAMAU, ESTADO DE BAJA CALIFORNIA NORTE""","TÉCNICAS MODERNAS DE INGENIERÍA, SOCIEDAD ANÓNIMA",SECRETARÍA DE AGRICULTURA Y RECURSOS HIDRÁULICOS (SARH),EIGZA-77-6 G,1,1,,https://sigagis.conagua.gob.mx/t_estudios24/INVENTARIO/02 BAJA CALIFORNIA/PDF/0034_EC.pdf,BAJA CALIFORNIA
36,DIGITAL,1975,BAJA CALIFORNIA,"INFORME GEOHIDROLÓGICO DE LA CUENCA DEL ARROYO TECATE, BAJA CALIFORNIA NORTE","INFORME GEOHIDROLÓGICO DE LA CUENCA DEL ARROYO TECATE, BAJA CALIFORNIA NORTE",,SECRETARÍA DE RECURSOS HIDRÁULICOS (SRH),,1,1,,https://sigagis.conagua.gob.mx/t_estudios24/INVENTARIO/02 BAJA CALIFORNIA/PDF/0036_EC.pdf,BAJA CALIFORNIA
37,DIGITAL,1981,ZACATECAS,"ESTUDIO GEOHIDROLÓGICO DE LA ZONA ""LA BLANCA"", ESTADO DE ZACATECAS
TOMO 1","ESTUDIO GEOHIDROLÓGICO DE LA ZONA ""LA BLANCA"", ESTADO DE ZACATECAS
TOMO 1","BUFETE GEOLÓGICO Y CIENCIAS AFINES, SOCIEDAD ANÓNIMA",SECRETARÍA DE AGRICULTURA Y RECURSOS HIDRÁULICOS (SARH),OHIADR-E-83-39,1,1,,https://sigagis.conagua.gob.mx/t_estudios24/INVENTARIO/32 ZACATECAS/PDF/0037_EC.pdf,ZACATECAS
38,AMBOS,1975,BAJA CALIFORNIA,ESTUDIO GEOHIDROLÓGICO DEL VALLE DE LA MISIÓN EN EL ESTADO DE BAJA CALIFORNIA NORTE,ESTUDIO GEOHIDROLÓGICO DEL VALLE DE LA MISIÓN EN EL ESTADO DE BAJA CALIFORNIA NORTE,"TÉCNICAS MODERNAS DE INGENIERÍA, SOCIEDAD ANÓNIMA",SECRETARÍA DE RECURSOS HIDRÁULICOS (SRH),EIGZA-74-23 Y EIGZA-75-10,1,1,,https://sigagis.conagua.gob.mx/t_estudios24/INVENTARIO/02 BAJA CALIFORNIA/PDF/0038_EC.pdf,BAJA CALIFORNIA
39,AMBOS,1974,BAJA CALIFORNIA,"ESTUDIO GEOHIDROLÓGICO DEL VALLE DE SAN QUINTÍN, ESTADO DE BAJA CALIFORNIA.","ESTUDIO GEOHIDROLÓGICO DEL VALLE DE SAN QUINTÍN, ESTADO DE BAJA CALIFORNIA","TÉCNICAS MODERNAS DE INGENIERÍA, SOCIEDAD ANÓNIMA",SECRETARÍA DE RECURSOS HIDRÁULICOS (SRH),EIGZA-74-23,1,1,,https://sigagis.conagua.gob.mx/t_estudios24/INVENTARIO/02 BAJA CALIFORNIA/PDF/0039_EC.pdf,BAJA CALIFORNIA
40,DIGITAL,1974,BAJA CALIFORNIA,ESTUDIO GEOHIDROLÓGICO DEL VALLE DE LA TRINIDAD EN EL ESTADO DE BAJA CALIFORNIA NORTE,ESTUDIO GEOHIDROLÓGICO DEL VALLE DE LA TRINIDAD EN EL ESTADO DE BAJA CALIFORNIA NORTE,"TÉCNICAS MODERNAS DE INGENIERÍA, SOCIEDAD ANÓNIMA",SECRETARÍA DE RECURSOS HIDRÁULICOS (SRH),EIGZA-74-23,1,1,,https://sigagis.conagua.gob.mx/t_estudios24/INVENTARIO/02 BAJA CALIFORNIA/PDF/0040_EC.pdf,BAJA CALIFORNIA
41,DIGITAL,1977,BAJA CALIFORNIA,"INFORME FINAL DEL ""ESTUDIO GEOHIDROLÓGICO DEL VALLE SAN RAFAEL, ESTADO DE BAJA CALIFORNIA NORTE""","INFORME FINAL DEL ""ESTUDIO GEOHIDROLÓGICO DEL VALLE SAN RAFAEL, ESTADO DE BAJA CALIFORNIA NORTE""","TÉCNICAS MODERNAS DE INGENIERÍA, SOCIEDAD ANÓNIMA",SECRETARÍA DE AGRICULTURA Y RECURSOS HIDRÁULICOS (SARH),EIGZA-76-3,1,1,,https://sigagis.conagua.gob.mx/t_estudios24/INVENTARIO/02 BAJA CALIFORNIA/PDF/0041_EC.pdf,BAJA CALIFORNIA
42,DIGITAL,1974,BAJA CALIFORNIA,ESTUDIO GEOHIDROLÓGICO DEL VALLE DE LAS PALMAS EN EL ESTADO DE BAJA CALIFORNIA NORTE,ESTUDIO GEOHIDROLÓGICO DEL VALLE DE LAS PALMAS EN EL ESTADO DE BAJA CALIFORNIA NORTE,"TÉCNICAS MODERNAS DE INGENIERÍA, SOCIEDAD ANÓNIMA",SECRETARÍA DE RECURSOS HIDRÁULICOS (SRH),EIGZA-74-23,1,1,,https://sigagis.conagua.gob.mx/t_estudios24/INVENTARIO/02 BAJA CALIFORNIA/PDF/0042_EC.pdf,BAJA CALIFORNIA
43,AMBOS,2006,ZACATECAS,"ESTUDIO HIDROGEOLÓGICO CONSECUTIVO Y EVALUACIÓN INTEGRAL DEL ACUÍFERO ADMINISTRATIVO CEDROS, EN EL MUNICIPIO DE MAZAPIL, ZACATECAS","ESTUDIO HIDROGEOLÓGICO CONSECUTIVO Y EVALUACIÓN INTEGRAL DEL ACUÍFERO ADMINISTRATIVO CEDROS, EN EL MUNICIPIO DE MAZAPIL, ZACATECAS",DESARROLLO Y SISTEMAS. SOCIEDAD ANÓNIMA DE CAPITAL VARIABLE,M3 MEXICANA SOCIEDAD DE RESPONSABILIDAD LIMITADA DE CAPITAL VARIABLE,,1,1,https://sigagis.conagua.gob.mx/t_estudios24/INVENTARIO/32 ZACATECAS/PDF/0043_CC.pdf,,ZACATECAS
44,AMBOS,1977,BAJA CALIFORNIA,"INFORME FINAL DEL ""ESTUDIO GEOHIDROLÓGICO VALLE DE CAMALÚ, ESTADO DE BAJA CALIFORNIA NORTE""","INFORME FINAL DEL ""ESTUDIO GEOHIDROLÓGICO VALLE DE CAMALÚ, ESTADO DE BAJA CALIFORNIA NORTE""","TÉCNICAS MODERNAS DE INGENIERÍA, SOCIEDAD ANÓNIMA",SECRETARÍA DE AGRICULTURA Y RECURSOS HIDRÁULICOS (SARH),EIGZA-76-3,1,1,,https://sigagis.conagua.gob.mx/t_estudios24/INVENTARIO/02 BAJA CALIFORNIA/PDF/0044_EC.pdf,BAJA CALIFORNIA
45,AMBOS,1980,ZACATECAS,"ESTUDIO DE PROSPECCIÓN Y LEVANTAMIENTOS GEOLÓGICOS Y GEOFÍSICOS EN LA ZONA GUADALUPE DE LAS CORRIENTES, EN EL EDO. DE ZACATECAS ","ESTUDIO DE PROSPECCIÓN Y LEVANTAMIENTOS GEOLÓGICOS Y GEOFÍSICOS EN LA ZONA GUADALUPE DE LAS CORRIENTES, EN EL EDO. DE ZACATECAS ","CONSTRUCTORA PAREYA, SOCIEDAD ANÓNIMA",SECRETARÍA DE ASENTAMIENTOS HUMANOS Y OBRAS PÚBLICAS (SAHOP),GZA-79-46-ED,1,1,,https://sigagis.conagua.gob.mx/t_estudios24/INVENTARIO/32 ZACATECAS/PDF/0045_EC.pdf,ZACATECAS
46,DIGITAL,1977,ZACATECAS,"ESTUDIO GEOHIDROLÓGICO PRELIMINAR DE LA ZONA DE OJO CALIENTE, ZAC.","ESTUDIO GEOHIDROLÓGICO PRELIMINAR DE LA ZONA DE OJO CALIENTE, ZACATECAS","CONSULTORES, SOCIEDAD ANÓNIMA",SECRETARÍA DE AGRICULTURA Y RECURSOS HIDRÁULICOS (SARH),EIGZA-74-16 G,1,1,,https://sigagis.conagua.gob.mx/t_estudios24/INVENTARIO/32 ZACATECAS/PDF/0046_EC.pdf,ZACATECAS
47,FÍSICO,2006,BAJA CALIFORNIA,"ESTUDIO DE ACTUALIZACIÓN GEOHIDROLÓGICA DEL ACUÍFERO DE SAN SIMÓN, EN EL ESTADO DE BAJA CALIFORNIA","ESTUDIO DE ACTUALIZACIÓN GEOHIDROLÓGICA DEL ACUÍFERO DE SAN SIMÓN, EN EL ESTADO DE BAJA CALIFORNIA","SANX INGENIERÍA INTEGRAL Y DESARROLLO, SOCIEDAD ANÓNIMA DE CAPITAL VARIABLE",COMISIÓN NACIONAL DEL AGUA (CONAGUA),SGT-PBC-BC-06-GAS-021-RF-LP,1,1,https://sigagis.conagua.gob.mx/t_estudios24/INVENTARIO/02 BAJA CALIFORNIA/PDF/0047_CC.pdf,,BAJA CALIFORNIA
48,DIGITAL,1974,BAJA CALIFORNIA,ESTUDIO GEOHIDROLÓGICO DEL VALLE DE MANEADERO EN EL ESTADO DE BAJA CALIFORNIA NORTE,ESTUDIO GEOHIDROLÓGICO DEL VALLE DE MANEADERO EN EL ESTADO DE BAJA CALIFORNIA NORTE,"TÉCNICAS MODERNAS DE INGENIERÍA, SOCIEDAD ANÓNIMA",SECRETARÍA DE RECURSOS HIDRÁULICOS (SRH),EIGZA-74-23,1,1,,https://sigagis.conagua.gob.mx/t_estudios24/INVENTARIO/02 BAJA CALIFORNIA/PDF/0048_EC.pdf,BAJA CALIFORNIA
50,DIGITAL,1993,COAHUILA DE ZARAGOZA,ESTUDIO HIDROGEOQUÍMICO E ISOTÓPICO DEL ACUÍFERO GRANULAR DE LA COMARCA LAGUNERA,ESTUDIO HIDROGEOQUÍMICO E ISOTÓPICO DEL ACUÍFERO GRANULAR DE LA COMARCA LAGUNERA,,INSTITUTO MEXICANO DE TECNOLOGÍA DEL AGUA (IMTA),,1,1,,https://sigagis.conagua.gob.mx/t_estudios24/INVENTARIO/05 COAHUILA DE ZARAGOZA/PDF/0050_EC.pdf,COAHUILA DE ZARAGOZA
51,DIGITAL,1980,BAJA CALIFORNIA,"ACTUALIZACIÓN DEL ESTUDIO GEOHIDROLÓGICO DEL VALLE DE MEXICALI, B.C.","ACTUALIZACIÓN DEL ESTUDIO GEOHIDROLÓGICO DEL VALLE DE MEXICALI, BAJA CALIFORNIA","ESTUDIOS Y CONSTRUCCIONES ALAS, SOCIEDAD ANÓNIMA",SECRETARÍA DE AGRICULTURA Y RECURSOS HIDRÁULICOS (SARH),80-88-D,1,1,,https://sigagis.conagua.gob.mx/t_estudios24/INVENTARIO/02 BAJA CALIFORNIA/PDF/0051_EC.pdf,BAJA CALIFORNIA
52,FÍSICO,1977,BAJA CALIFORNIA,"INFORME FINAL DEL ESTUDIO GEOFÍSICO DEL VALLE DE SAN QUINTÍN, ESTADO DE BAJA CALIFORNIA NORTE","ESTUDIO GEOHIDROLÓGICO EN EL VALLE DE SAN QUINTÍN, ESTADO DE BAJA CALIFORNIA","TÉCNICAS MODERNAS DE INGENIERÍA, SOCIEDAD ANÓNIMA",SECRETARÍA DE RECURSOS HIDRÁULICOS (SRH),EIGZA-74-3,1,1,,https://sigagis.conagua.gob.mx/t_estudios24/INVENTARIO/02 BAJA CALIFORNIA/PDF/0052_EC.pdf,BAJA CALIFORNIA
53,AMBOS,1977,BAJA CALIFORNIA,"INFORME FINAL DEL ""ESTUDIO GEOFÍSICO DE LOS VALLES SAN PEDRO MÁRTIR Y VALLE CHICO, ESTADO DE BAJA CALIFORNIA NORTE""","INFORME FINAL DEL ""ESTUDIO GEOFÍSICO DE LOS VALLES SAN PEDRO MÁRTIR Y VALLE CHICO, ESTADO DE BAJA CALIFORNIA NORTE""","TÉCNICAS MODERNAS DE INGENIERÍA, SOCIEDAD ANÓNIMA",SECRETARÍA DE AGRICULTURA Y RECURSOS HIDRÁULICOS (SARH),EIGZA-76-3,4,1,,https://sigagis.conagua.gob.mx/t_estudios24/INVENTARIO/02 BAJA CALIFORNIA/PDF/0053_EC.pdf,BAJA CALIFORNIA
54,DIGITAL,1977,BAJA CALIFORNIA,"INFORME FINAL DEL ESTUDIO GEOFÍSICO DEL VALLE DE MANEADERO, ESTADO DE BAJA CALIFORNIA NORTE","INFORME FINAL DEL ESTUDIO GEOFÍSICO DEL VALLE DE MANEADERO, ESTADO DE BAJA CALIFORNIA NORTE","TÉCNICAS MODERNAS DE INGENIERÍA, SOCIEDAD ANÓNIMA",SECRETARÍA DE AGRICULTURA Y RECURSOS HIDRÁULICOS (SARH),EIGZA-77-6 G,1,1,,https://sigagis.conagua.gob.mx/t_estudios24/INVENTARIO/02 BAJA CALIFORNIA/PDF/0054_EC.pdf,BAJA CALIFORNIA
55,DIGITAL,1990,BAJA CALIFORNIA,"ESTUDIO DE ACTUALIZACIÓN PIEZOMÉTRICA Y GEOQUÍMICA DEL VALLE DE SAN VICENTE, MUNICIPIO DE ENSENADA, B.C.","ESTUDIO DE ACTUALIZACIÓN PIEZOMÉTRICA Y GEOQUÍMICA DEL VALLE DE SAN VICENTE, MUNICIPIO DE ENSENADA, BAJA CALIFORNIA",,COMISIÓN NACIONAL DEL AGUA (CONAGUA),,1,1,,https://sigagis.conagua.gob.mx/t_estudios24/INVENTARIO/02 BAJA CALIFORNIA/PDF/0055_EC.pdf,BAJA CALIFORNIA
56,DIGITAL,1979,BAJA CALIFORNIA,ESTUDIO GEOHIDROLÓGICO DEL VALLE DE TIJUANA EN ESTADO DE BAJA CALIFORNIA NORTE,ESTUDIO GEOHIDROLÓGICO DEL VALLE DE TIJUANA EN ESTADO DE BAJA CALIFORNIA NORTE,"TÉCNICAS MODERNAS DE INGENIERÍA, SOCIEDAD ANÓNIMA",SECRETARÍA DE AGRICULTURA Y RECURSOS HIDRÁULICOS (SARH),GZA-79-18 GD,1,1,,https://sigagis.conagua.gob.mx/t_estudios24/INVENTARIO/02 BAJA CALIFORNIA/PDF/0056_EC.pdf,BAJA CALIFORNIA
58,DIGITAL,1977,BAJA CALIFORNIA,"INFORME FINAL DEL ESTUDIO GEOHIDROLÓGICO DEL VALLE DE GUADALUPE, ESTADO DE BAJA CALIFORNIA NORTE","INFORME FINAL DEL ESTUDIO GEOHIDROLÓGICO DEL VALLE DE GUADALUPE, ESTADO DE BAJA CALIFORNIA NORTE","TÉCNICAS MODERNAS DE INGENIERÍA, SOCIEDAD ANÓNIMA",SECRETARÍA DE AGRICULTURA Y RECURSOS HIDRÁULICOS (SARH),EIGZA-77-6 G,1,1,,https://sigagis.conagua.gob.mx/t_estudios24/INVENTARIO/02 BAJA CALIFORNIA/PDF/0058_EC.pdf,BAJA CALIFORNIA
59,DIGITAL,1977,BAJA CALIFORNIA,INFORME FINAL DEL ESTUDIO GEOHIDROLÓGICO DEL VALLE DE SAN VICENTE ESTADO DE BAJA CALIFORNIA NORTE,INFORME FINAL DEL ESTUDIO GEOHIDROLÓGICO DEL VALLE DE SAN VICENTE ESTADO DE BAJA CALIFORNIA NORTE,"TÉCNICAS MODERNAS DE INGENIERÍA, SOCIEDAD ANÓNIMA",SECRETARÍA DE AGRICULTURA Y RECURSOS HIDRÁULICOS (SARH),EIGZA-77-G,1,1,,https://sigagis.conagua.gob.mx/t_estudios24/INVENTARIO/02 BAJA CALIFORNIA/PDF/0059_EC.pdf,BAJA CALIFORNIA
60,DIGITAL,1979,BAJA CALIFORNIA,"ESTUDIO GEOHIDROLÓGICO DE LOS VALLES EL MÉDANO Y EL DESCANSO, EDO. DE ESTADO DE BAJA CALIFORNIA NORTE","ESTUDIO GEOHIDROLÓGICO DE LOS VALLES EL MÉDANO Y EL DESCANSO, ESTADO DE ESTADO DE BAJA CALIFORNIA NORTE","TÉCNICAS MODERNAS DE INGENIERÍA, SOCIEDAD ANÓNIMA",SECRETARÍA DE AGRICULTURA Y RECURSOS HIDRÁULICOS (SARH),GZA-79-18 GD,1,1,,https://sigagis.conagua.gob.mx/t_estudios24/INVENTARIO/02 BAJA CALIFORNIA/PDF/0060_EC.pdf,BAJA CALIFORNIA
61,DIGITAL,1991,COAHUILA DE ZARAGOZA,PROYECTO: GEOHIDROLOGÍA DE LA LAGUNA,PROYECTO: GEOHIDROLOGÍA DE LA LAGUNA,,INSTITUTO MEXICANO DE TECNOLOGÍA DEL AGUA (IMTA),,,,,https://sigagis.conagua.gob.mx/t_estudios24/INVENTARIO/05 COAHUILA DE ZARAGOZA/PDF/0061_EC.pdf,COAHUILA DE ZARAGOZA
