ID_ESTUDIOS,ESTATUS DE ESTUDIO,AÑO,ESTADOS,TITULO_ORIGINAL,TITULO_BUSQUEDA,EMPRESA,FUENTE,CONTRATO,EJEMPLARES,TOMOS,CARATULA,PDF,ESTADO_ARCHIVOS
3056,AMBOS,2010,JALISCO,"ESTUDIO DE ACTUALIZACIÓN GEOHIDROLÓGICA DE LOS ACUÍFEROS VALLE DE GUADALUPE, CUQUÍO, TEQUILA, JALOSTOTITLÁN Y COLOTLÁN EN EL ESTADO DE JALISCO
TOMO1: ACUÍFERO 1446 CUQUÍO (FÍSICO)
TOMO2: ACUÍFERO 1457 COLOTLÁN (FÍSICO Y DIGITAL)
TOMO3: ACUÍFERO 1437 TEQUILA (DIGITAL)","ESTUDIO DE ACTUALIZACIÓN GEOHIDROLÓGICA DE LOS ACUÍFEROS VALLE DE GUADALUPE, CUQUÍO, TEQUILA, JALOSTOTITLÁN Y COLOTLÁN EN EL ESTADO DE JALISCO
TOMO1: ACUÍFERO 1446 CUQUÍO (FÍSICO)
TOMO2: ACUÍFERO 1457 COLOTLÁN (FÍSICO Y DIGITAL)
TOMO3: ACUÍFERO 1437 TEQUILA (DIGITAL)",INSTITUTO MEXICANO DE TECNOLOGÍA DEL AGUA (IMTA),COMISIÓN NACIONAL DEL AGUA (CONAGUA),CNA-OCLSP-JAL-CONV-002-2010,1,2,https://sigagis.conagua.gob.mx/t_estudios24/INVENTARIO/14 JALISCO/PDF/3056_CC.pdf,,JALISCO
3057,FÍSICO,2010,CIUDAD DE MÉXICO,ESTUDIO DE MANEJO DE DEMANDA DE AGUAS SUBTERRÁNEA PARA EL ACUÍFERO ZONA METROPOLITANA DE LA CIUDAD DE MÉXICO,"ESTUDIO DE MANEJO DE DEMANDA DE AGUAS SUBTERRÁNEA PARA EL ACUÍFERO ZONA METROPOLITANA DE LA CIUDAD DE MÉXICO, DISTRITO FEDERAL, ACUÍFERO 0901 ZONA METROPOLITANA DE LA CIUDAD DE MÉXICO","INGENIERÍA Y SISTEMAS, SOCIEDAD ANÓNIMA (INSISA)",DEPARTAMENTO DEL DISTRITO FEDERAL (DDF),,1,1,https://sigagis.conagua.gob.mx/t_estudios24/INVENTARIO/09 CIUDAD DE MÉXICO/PDF/3057_CC.pdf,,CIUDAD DE MÉXICO
3061,FÍSICO,1999,SONORA,"ESTUDIO GEOFÍSICO REALIZADO EN TERRENOS DEL VIÑEDO 2000, UBICADO AL SUROESTE DE ESTACIÓN PESQUERÍA, MUNICIPIO DE SAN MIGUEL DE HORCASITA, SONORA.","ESTUDIO GEOFÍSICO REALIZADO EN TERRENOS DEL VIÑEDO 2000, UBICADO AL SUROESTE DE ESTACIÓN PESQUERÍA, MUNICIPIO DE SAN MIGUEL DE HORCASITA, SONORA.","ESTUDIOS HIDROGEOLÓGICOS Y GEOFÍSICOS, PERFORACIÓN DE POZOS, MATERIALES Y SERVICIOS PARA LA CONSTRUCCIÓN",,,1,1,https://sigagis.conagua.gob.mx/t_estudios24/INVENTARIO/26 SONORA/PDF/3061_CC.pdf,,SONORA
3062,FÍSICO,1999,SONORA,"EVALUACIÓN HIDROGEOLÓGICA INTEGRAL DEL PREDIO RURAL DEL SEÑOR ARTURO CASTELO, UBICADO EN EL MUNICIPIO DE SAN MIGUEL DE HORCASITA, ESTADO DE SONORA.","EVALUACIÓN HIDROGEOLÓGICA INTEGRAL DEL PREDIO RURAL DEL SEÑOR ARTURO CASTELO, UBICADO EN EL MUNICIPIO DE SAN MIGUEL DE HORCASITA, ESTADO DE SONORA.",CONSULTOR INDEPENDIENTE,,,1,1,https://sigagis.conagua.gob.mx/t_estudios24/INVENTARIO/26 SONORA/PDF/3062_CC.pdf,,SONORA
3063,AMBOS,1986,CIUDAD DE MÉXICO,"MANUAL TÉCNICO DE DISEÑO, CONSTRUCCIÓN, OPERACIÓN Y MANTENIMIENTO DE POZOS EN LAS CUENCAS DE MÉXICO Y DEL ALTO LERMA","MANUAL TÉCNICO DE DISEÑO, CONSTRUCCIÓN, OPERACIÓN Y MANTENIMIENTO DE POZOS EN LAS CUENCAS DE MÉXICO Y DEL ALTO LERMA, DISTRITO FEDERAL, CIUDAD DE MÉXICO, ACUÍFERO 0901 ZONA METROPOLITANA DE LA CIUDAD DE MÉXICO","INGENIEROS CIVILES HIDRÁULICOS, SOCIEDAD ANÓNIMA DE CAPITAL VARIABLE",GOBIERNO DEL DISTRITO FEDERAL,0-07-CO-04-1-0123,1,1,https://sigagis.conagua.gob.mx/t_estudios24/INVENTARIO/09 CIUDAD DE MÉXICO/PDF/3063_CC.pdf,https://sigagis.conagua.gob.mx/t_estudios24/INVENTARIO/09 CIUDAD DE MÉXICO/PDF/3063_EC.pdf,CIUDAD DE MÉXICO
3067,FÍSICO,2011,BAJA CALIFORNIA,"MODELO NUMÉRICO DE FLUJO PARA LA EVALUACIÓN DE LOS EFECTOS DEL REVESTIMIENTO DEL CTA EN LA ZONA NORTE-ORIENTAL DEL VALLE DE MEXICALI, B. C. (PRIMERA ETAPA)
","MODELO NUMÉRICO DE FLUJO PARA LA EVALUACIÓN DE LOS EFECTOS DEL REVESTIMIENTO DEL CTA EN LA ZONA NORTE-ORIENTAL DEL VALLE DE MEXICALI, B. C. (PRIMERA ETAPA)
",PROYECTO DE FORTALECIMIENTO DEL MANEJO INTEGRADO DEL AGUA (PREMIA),COMISIÓN NACIONAL DEL AGUA (CONAGUA),PREMIA NO. 1705-11/REM/PEX,1,1,https://sigagis.conagua.gob.mx/t_estudios24/INVENTARIO/02 BAJA CALIFORNIA/PDF/3067_CC.pdf,,BAJA CALIFORNIA
3068,FÍSICO,2009,QUERÉTARO,ACUEDUCTO II LA HISTORIA DETRÁS DE LA HISTORIA DE QUERÉTARO,ACUEDUCTO II LA HISTORIA DETRÁS DE LA HISTORIA DE QUERÉTARO,,,,1,1,https://sigagis.conagua.gob.mx/t_estudios24/INVENTARIO/22 QUERÉTARO/PDF/3068_CC.pdf,,QUERÉTARO
3071,FÍSICO,2000,CIUDAD DE MÉXICO,ESTUDIO PARA LA ACTUALIZACIÓN DE LA BASE DE DATOS DE MANANTIALES UBICADOS EN LA ZONA PONIENTE Y SUR PONIENTE A CARGO DE LA DIRECCIÓN GENERAL DE CONSTRUCCIÓN Y OPERACIÓN HIDRÁULICA EN EL DISTRITO FEDERAL,"ESTUDIO PARA LA ACTUALIZACIÓN DE LA BASE DE DATOS DE MANANTIALES UBICADOS EN LA ZONA PONIENTE Y SUR PONIENTE A CARGO DE LA DIRECCIÓN GENERAL DE CONSTRUCCIÓN Y OPERACIÓN HIDRÁULICA EN EL DISTRITO FEDERAL, CIUDAD DE MÉXICO, ACUÍFERO 0901 ZONA METROPOLITANA DE LA CIUDAD DE MÉXICO","LESSER Y ASOCIADOS, SOCIEDAD ANÓNIMA DE CAPITAL VARIABLE",COMISIÓN NACIONAL DEL AGUA (CONAGUA),GAS-005-PRO-96,1,1,https://sigagis.conagua.gob.mx/t_estudios24/INVENTARIO/09 CIUDAD DE MÉXICO/PDF/3071_CC.pdf,,CIUDAD DE MÉXICO
3072,FÍSICO,1995,GUANAJUATO,"COMPENDIO ESTUDIOS INSTITUTO DE GEOFÍSICA (IGF) SOBRE LOS COMPUESTOS DE CROMO EN EL VALLE DE LEÓN, GTO.
1) INVESTIGACIÓN DEL IMPACTO AMBIENTAL DE LA DISPERSIÓN DE COMPUESTOS DE CROMO EN EL ÁREA OCCIDENTAL-CENTRAL EN EL VALLE DE LEÓN, GTO.
2) ARTÍCULOS: 
- GROUNDWATER POLLUTION WITH CHROMIUM LEON, VALLEY, MEXICO
- ENVIRONMENTAL EXPOSURE TO CHROMIUM COMPOUNDS IN THA VALLEY OF LEÓN, MÉXICO.","COMPENDIO ESTUDIOS INSTITUTO DE GEOFÍSICA (IGF) SOBRE LOS COMPUESTOS DE CROMO EN EL VALLE DE LEÓN, GTO.
1) INVESTIGACIÓN DEL IMPACTO AMBIENTAL DE LA DISPERSIÓN DE COMPUESTOS DE CROMO EN EL ÁREA OCCIDENTAL-CENTRAL EN EL VALLE DE LEÓN, GTO.
2) ARTÍCULOS: 
- GROUNDWATER POLLUTION WITH CHROMIUM LEON, VALLEY, MEXICO
- ENVIRONMENTAL EXPOSURE TO CHROMIUM COMPOUNDS IN THA VALLEY OF LEÓN, MÉXICO.",UNIVERSIDAD NACIONAL AUTÓNOMA DE MÉXICO (UNAM),COMISIÓN NACIONAL DEL AGUA (CONAGUA),,1,1,https://sigagis.conagua.gob.mx/t_estudios24/INVENTARIO/11 GUANAJUATO/PDF/3072_CC.pdf,,GUANAJUATO
3074,AMBOS,1990,GUERRERO,"ACUEDUCTO MOCHISTLÁN-CHILPANCINGO, GRO.
PERFORACIÓN DE 5 POZOS","ACUEDUCTO MOCHISTLÁN-CHILPANCINGO, GRO.
PERFORACIÓN DE 5 POZOS","CONSTRUCTORA Y PERFORACIONES CIELO VISTA, SOCIEDAD ANÓNIMA DE CAPITAL VARIABLE.",COMISIÓN NACIONAL DEL AGUA (CONAGUA),CC-89-01 C,1,1,,https://sigagis.conagua.gob.mx/t_estudios24/INVENTARIO/12 GUERRERO/PDF/3074_EC.pdf,GUERRERO
3084,DIGITAL,1984,BAJA CALIFORNIA SUR,"ANÁLISIS DEL COMPORTAMIENTO DE LOS ACUÍFEROS DEL DESARROLLO TURÍSTICO DE LORETO, B.C.S.","ANÁLISIS DEL COMPORTAMIENTO DE LOS ACUÍFEROS DEL DESARROLLO TURÍSTICO DE LORETO, BAJA CALIFORNIA SUR","INGENIERÍA DE EVALUACIÓN Y PROSPECCIÓN, SOCIEDAD ANÓNIMA DE CAPITAL VARIABLE (IEPSA)",FONDO NACIONAL DE FOMENTO AL TURISMO (FONATUR),,1,1,,https://sigagis.conagua.gob.mx/t_estudios24/INVENTARIO/03 BAJA CALIFORNIA SUR/PDF/3084_EC.pdf,BAJA CALIFORNIA SUR
3085,FÍSICO,,HIDALGO,"CENSO DE POZOS DEL VALLE DE MEZQUITAL, ESTADO DE HIDALGO","CENSO DE POZOS DEL VALLE DE MEZQUITAL, ESTADO DE HIDALGO",SECRETARÍA DE RECURSOS HIDRÁULICOS (SRH),SECRETARÍA DE RECURSOS HIDRÁULICOS (SRH),,1,1,https://sigagis.conagua.gob.mx/t_estudios24/INVENTARIO/13 HIDALGO/PDF/3085_CC.pdf,,HIDALGO
3087,AMBOS,2013,COLIMA,"ESTUDIO DE EXPLORACIÓN HIDROGEOLÓGICA PARA DETERMINAR LA POSICIÓN DE LA INTERFASE SALINA EN LA ZONA COSTERA DEL ACUÍFERO JALAPA-TAPEIXTLES, EN EL ESTADO DE COLIMA","ESTUDIO DE EXPLORACIÓN HIDROGEOLÓGICA PARA DETERMINAR LA POSICIÓN DE LA INTERFASE SALINA EN LA ZONA COSTERA DEL ACUÍFERO JALAPA-TAPEIXTLES, EN EL ESTADO DE COLIMA",SERVICIO GEOLÓGICO MEXICANO (SGM),COMISIÓN NACIONAL DEL AGUA (CONAGUA),GAS-013-PRO04,1,1,https://sigagis.conagua.gob.mx/t_estudios24/INVENTARIO/06 COLIMA/PDF/3087_CC.pdf,,COLIMA
3089,AMBOS,2005,COAHUILA DE ZARAGOZA,"INSTRUMENTACIÓN PARA EL MONITOREO PIEZOMÉTRICO DEL ACUÍFERO ALLENDE PIEDRAS NEGRAS, COAHUILA INFORME FINAL DICIEMBRE 2005
TOMO COMPLETO Y TOMO SOLO CON ANEXOS","INSTRUMENTACIÓN PARA EL MONITOREO PIEZOMÉTRICO DEL ACUÍFERO ALLENDE PIEDRAS NEGRAS, COAHUILA INFORME FINAL DICIEMBRE 2005
TOMO COMPLETO Y TOMO SOLO CON ANEXOS","SERVICIOS DE INGENIERÍA E INVESTIGACIÓN DEL MEDIO AMBIENTE, SOCIEDAD CIVIL (SIIMA)",BANCO DE DESARROLLO DE AMÉRICA DEL NORTE (BDAN),75130113 CHECAR,2,1,https://sigagis.conagua.gob.mx/t_estudios24/INVENTARIO/05 COAHUILA DE ZARAGOZA/PDF/3089_CC.pdf,,COAHUILA DE ZARAGOZA
3091,AMBOS,1987,CHIHUAHUA,"ANÁLISIS DEL ESTUDIO GEOHIDROLÓGICO DEL ACUÍFERO DE SAMALAYUCA, CHIHUAHUA. Y DISEÑO DE UNA POLÍTICA DE EXPLOTACIÓN OPTIMA PARA EL ABASTECIMIENTO DE LA CENTRAL TERMOELÉCTRICA DE SAMALAYUCA.","ANÁLISIS DEL ESTUDIO GEOHIDROLÓGICO DEL ACUÍFERO DE SAMALAYUCA, CHIHUAHUA. Y DISEÑO DE UNA POLÍTICA DE EXPLOTACIÓN OPTIMA PARA EL ABASTECIMIENTO DE LA CENTRAL TERMOELÉCTRICA DE SAMALAYUCA.",COMISIÓN FEDERAL DE ELECTRICIDAD (CFE),COMISIÓN FEDERAL DE ELECTRICIDAD (CFE),872009,1,1,https://sigagis.conagua.gob.mx/t_estudios24/INVENTARIO/08 CHIHUAHUA/PDF/3091_CC.pdf,https://sigagis.conagua.gob.mx/t_estudios24/INVENTARIO/08 CHIHUAHUA/PDF/3091_EC.pdf,CHIHUAHUA
3092,AMBOS,2014,CAMPECHE,ESTUDIO GEOHIDROLÓGICO SOBRE LOS EFECTOS DE LA EXPLOTACIÓN DEL AGUA SUBTERRÁNEA EN EL MUNICIPIO DE CHAMPOTÓN EN EL ESTADO DE CAMPECHE,ESTUDIO GEOHIDROLÓGICO SOBRE LOS EFECTOS DE LA EXPLOTACIÓN DEL AGUA SUBTERRÁNEA EN EL MUNICIPIO DE CHAMPOTÓN EN EL ESTADO DE CAMPECHE,GEO EVALUACIONES Y PERFORACIONES SOCIEDAD ANÓNIMA DE CAPITAL VARIABLE,COMISIÓN NACIONAL DEL AGUA (CONAGUA),SGT-OCPY-CAM-14-27-RF-I3,1,2,https://sigagis.conagua.gob.mx/t_estudios24/INVENTARIO/04 CAMPECHE/PDF/3092_CC.pdf,https://sigagis.conagua.gob.mx/t_estudios24/INVENTARIO/04 CAMPECHE/PDF/3092_EC.pdf,CAMPECHE
3101,FÍSICO,2002,DURANGO,"REACTIVACIÓN DE REDES DE MONITOREO PIEZOMÉTRICO DE LOS ACUÍFEROS DE LOS VALLES DE: CEBALLOS, VILLA JUÁREZ Y RÍO NAZAS, DGO.","REACTIVACIÓN DE REDES DE MONITOREO PIEZOMÉTRICO DE LOS ACUÍFEROS DE LOS VALLES DE: CEBALLOS, VILLA JUÁREZ Y RÍO NAZAS, DURANGO","ESTUDIOS Y PROYECTOS DE AGUA Y TIERRA RUBRISELVA, SOCIEDAD ANÓNIMA DE CAPITAL VARIABLE",COMISIÓN NACIONAL DEL AGUA (CONAGUA),GAS-009-PRO-02,1,1,https://sigagis.conagua.gob.mx/t_estudios24/INVENTARIO/10 DURANGO/PDF/3101_CC.pdf,,DURANGO
3103,FÍSICO,1995,GUANAJUATO,"EFECTOS DEL REÚSO DE AGUAS RESIDUALES SOBRE LOS RECURSOS DE AGUA SUBTERRÁNEA PARA USO URBANO EN EL VALLE DE LEÓN, GTO. FASE II PERFORACIÓN EXPLORATORIA.","EFECTOS DEL REÚSO DE AGUAS RESIDUALES SOBRE LOS RECURSOS DE AGUA SUBTERRÁNEA PARA USO URBANO EN EL VALLE DE LEÓN, GTO. FASE II PERFORACIÓN EXPLORATORIA.",COMISSION OF EUROPEAN COMUNITY-OVERSEAS DEVELOPMENT ADMINISTRATION,COMISIÓN NACIONAL DEL AGUA (CONAGUA)-BRITISH GEOLÓGICAL SURVEY,,1,3,https://sigagis.conagua.gob.mx/t_estudios24/INVENTARIO/11 GUANAJUATO/PDF/3103_CC.pdf,,GUANAJUATO
3105,DIGITAL,1985,NAYARIT,"INFORME GEOHIDROLÓGICO DE EXPLORACIÓN GEOFÍSICA Y RESULTADO DE LOS S.E.V. EFECTUADOS EN LA ZONA DE SANTA MARÍA DEL ORO, ESTADO DE NAYARIT","INFORME GEOHIDROLÓGICO DE EXPLORACIÓN GEOFÍSICA Y RESULTADO DE LOS SONDEOS ELÉCTRICOS VERTICALES EFECTUADOS EN LA ZONA DE SANTA MARÍA DEL ORO, ESTADO DE NAYARIT, 1812 VALLE DE SANTA MARIA DEL ORO",,SECRETARÍA DE AGRICULTURA Y RECURSOS HIDRÁULICOS (SARH),,1,1,https://sigagis.conagua.gob.mx/t_estudios24/INVENTARIO/18 NAYARIT/PDF/3105_CC.pdf,https://sigagis.conagua.gob.mx/t_estudios24/INVENTARIO/18 NAYARIT/PDF/3105_EC.pdf,NAYARIT
3108,AMBOS,2000,HIDALGO,"REACTIVACIÓN DE REDES DE MONITOREO PIEZOMÉTRICO DE LOS ACUÍFEROS DE LOS VALLES DE: MEZQUITAL, ÁPAN, TULANCINGO Y HUICHAPAN-TECOZAUTLA, ESTADO DE HIDALGO","REACTIVACIÓN DE REDES DE MONITOREO PIEZOMÉTRICO DE LOS ACUÍFEROS DE LOS VALLES DE: MEZQUITAL, ÁPAN, TULANCINGO Y HUICHAPAN-TECOZAUTLA, ESTADO DE HIDALGO","LESSER Y ASOCIADOS, SOCIEDAD ANÓNIMA DE CAPITAL VARIABLE",COMISIÓN NACIONAL DEL AGUA (CONAGUA),GAS-017-PRO2000,1,1,https://sigagis.conagua.gob.mx/t_estudios24/INVENTARIO/13 HIDALGO/PDF/3108_CC.pdf,,HIDALGO
3112,DIGITAL,1991,HIDALGO,ESTUDIO GEOHIDROLÓGICO EN VARIOS SITIOS DEL ESTADO DE HIDALGO.,ESTUDIO GEOHIDROLÓGICO EN VARIOS SITIOS DEL ESTADO DE HIDALGO.,COMISIÓN NACIONAL DEL AGUA (CONAGUA),COMISIÓN NACIONAL DEL AGUA (CONAGUA),,1,1,,https://sigagis.conagua.gob.mx/t_estudios24/INVENTARIO/13 HIDALGO/PDF/3112_EC.pdf,HIDALGO
3123,FÍSICO,2000,CHIHUAHUA,"PROSPECCIÓN HIDROGEOLÓGICA E HIDROGEOQUÍMICA EN EL BOLSÓN DE LA MESILLA, CHIHUAHUA. (ZONA DE CONEJOS-MÉDANOS)","PROSPECCIÓN HIDROGEOLÓGICA E HIDROGEOQUÍMICA EN EL BOLSÓN DE LA MESILLA, CHIHUAHUA. (ZONA DE CONEJOS-MÉDANOS)",,"JUNTA CENTRAL DE AGUA Y SANEAMIENTO, CHIHUAHUA (JMAS)",,1,1,https://sigagis.conagua.gob.mx/t_estudios24/INVENTARIO/08 CHIHUAHUA/PDF/3123_CC.pdf,,CHIHUAHUA
3124,FÍSICO,2000,CHIHUAHUA,"MODELO DE MEZCLA DE AGUA PROVENIENTE DE POZOS DE LA BATERÍA DE CONEJOS-MÉDANOS JUÁREZ, CHIH.","MODELO DE MEZCLA DE AGUA PROVENIENTE DE POZOS DE LA BATERÍA DE CONEJOS-MÉDANOS JUÁREZ, CHIHUAHUA",,"JUNTA CENTRAL DE AGUA Y SANEAMIENTO, CHIHUAHUA (JMAS)",,1,1,https://sigagis.conagua.gob.mx/t_estudios24/INVENTARIO/08 CHIHUAHUA/PDF/3124_CC.pdf,,CHIHUAHUA
3125,FÍSICO,2000,CHIHUAHUA,"PROSPECCIÓN GEOFÍSICA EN LA ZONA DE TERRAZAS, VALLE DE JUÁREZ, MUNICIPIO DE JUÁREZ, CHIHUAHUA.","PROSPECCIÓN GEOFÍSICA EN LA ZONA DE TERRAZAS, VALLE DE JUÁREZ, MUNICIPIO DE JUÁREZ, CHIHUAHUA.",,"JUNTA CENTRAL DE AGUA Y SANEAMIENTO, CHIHUAHUA (JMAS)",,1,1,https://sigagis.conagua.gob.mx/t_estudios24/INVENTARIO/08 CHIHUAHUA/PDF/3125_CC.pdf,,CHIHUAHUA
3128,FÍSICO,2000,MORELOS,"INFORME SOBRE LAS CONDICIONES GEOHIDROLÓGICAS DE LOS VALLES DE ATONGO Y CUERNAVACA EN EL ESTADO DE MORELOS
","INFORME SOBRE LAS CONDICIONES GEOHIDROLÓGICAS DE LOS VALLES DE ATONGO Y CUERNAVACA EN EL ESTADO DE MORELOS
",,COMISIÓN NACIONAL DEL AGUA (CONAGUA),,1,1,https://sigagis.conagua.gob.mx/t_estudios24/INVENTARIO/17 MORELOS/PDF/3128_CC.pdf,,MORELOS
3129,AMBOS,1999,SONORA,"MODELO DE SIMULACIÓN HIDRODINÁMICA DEL ACUÍFERO MESA DEL SERI-LA VICTORIA, SONORA","MODELO DE SIMULACIÓN HIDRODINÁMICA DEL ACUÍFERO MESA DEL SERI-LA VICTORIA, SONORA",,COMISIÓN NACIONAL DEL AGUA (CONAGUA),GAS/99/01,168,1,https://sigagis.conagua.gob.mx/t_estudios24/INVENTARIO/26 SONORA/PDF/3129_CC.pdf,https://sigagis.conagua.gob.mx/t_estudios24/INVENTARIO/26 SONORA/PDF/3129_EC.pdf,SONORA
3130,DIGITAL,2007,BAJA CALIFORNIA,"ESTUDIO GEOHIDROLÓGICO DE LA ZONA COMPRENDIDA ENTRE EL RANCHO SANTA ANITA, PRESA ABELARDO L. RODRÍGUEZ Y EL VALLE DE LAS PALMAS, BAJA CALIFORNIA.","ESTUDIO GEOHIDROLÓGICO DE LA ZONA COMPRENDIDA ENTRE EL RANCHO SANTA ANITA, PRESA ABELARDO L. RODRÍGUEZ Y EL VALLE DE LAS PALMAS, BAJA CALIFORNIA.",INSTITUTO MEXICANO DE TECNOLOGÍA DEL AGUA (IMTA),COMISIÓN NACIONAL DEL AGUA (CONAGUA),,1,1,,https://sigagis.conagua.gob.mx/t_estudios24/INVENTARIO/02 BAJA CALIFORNIA/PDF/3130_EC.pdf,BAJA CALIFORNIA
3131,DIGITAL,2005,JALISCO,"ESTUDIO DE ACTUALIZACIÓN GEOHIDROLÓGICA DE LOS ACUÍFEROS LA BARCA, SAN JOSÉ DE LAS PILAS, SAN DIEGO DE ALEJANDRÍA Y JESÚS MARÍA
TOMO1: 1408 LA BARCA 
TOMO 2: 1444 SAN DIEGO DE ALEJANDRÍA
TOMO 3: 1445 SAN JOSÉ DE LAS PILAS
TOMO 4: 1459 JESÚS MARÍA
","ESTUDIO DE ACTUALIZACIÓN GEOHIDROLÓGICA DE LOS ACUÍFEROS LA BARCA, SAN JOSÉ DE LAS PILAS, SAN DIEGO DE ALEJANDRÍA Y JESÚS MARÍA
TOMO1: 1408 LA BARCA 
TOMO 2: 1444 SAN DIEGO DE ALEJANDRÍA
TOMO 3: 1445 SAN JOSÉ DE LAS PILAS
TOMO 4: 1459 JESÚS MARÍA
","PROYECTOS Y TRÁMITES Y SUPERVISIÓN DE CONSTRUCCIONES, SOCIEDAD ANÓNIMA DE CAPITAL VARIABLE",COMISIÓN NACIONAL DEL AGUA (CONAGUA),SGT-LSP-JAL-05-040-RF LP,9,9,,https://sigagis.conagua.gob.mx/t_estudios24/INVENTARIO/14 JALISCO/PDF/3131_EC.pdf,JALISCO
3132,DIGITAL,1999,BAJA CALIFORNIA,"MODELO DE SIMULACIÓN HIDRODINÁMICA DEL ACUÍFERO DEL VALLE DE GUADALUPE, B.C.","MODELO DE SIMULACIÓN HIDRODINÁMICA DEL ACUÍFERO DEL VALLE DE GUADALUPE, BAJA CALIFORNIA",DESARROLLO Y SISTEMAS. SOCIEDAD ANÓNIMA DE CAPITAL VARIABLE,COMISIÓN NACIONAL DEL AGUA (CONAGUA),,1,1,,https://sigagis.conagua.gob.mx/t_estudios24/INVENTARIO/02 BAJA CALIFORNIA/PDF/3132_EC.pdf,BAJA CALIFORNIA
3136,DIGITAL,1984,QUINTANA ROO,"PROYECTO PARA LA DISPOSICIÓN DE AGUAS TRATADAS EXCEDENTES EN CANCÚN, Q. ROO
","PROYECTO PARA LA DISPOSICIÓN DE AGUAS TRATADAS EXCEDENTES EN CANCÚN, QUINTANA ROO
","LESSER Y ASOCIADOS, SOCIEDAD ANÓNIMA DE CAPITAL VARIABLE",FONDO NACIONAL DE FOMENTO AL TURISMO (FONATUR),PS-CCPH-8406/01,1,1,https://sigagis.conagua.gob.mx/t_estudios24/INVENTARIO/23 QUINTANA ROO/PDF/3136_CC.pdf,https://sigagis.conagua.gob.mx/t_estudios24/INVENTARIO/23 QUINTANA ROO/PDF/3136_EC.pdf,QUINTANA ROO
3137,DIGITAL,2006,BAJA CALIFORNIA,"INFORME DEL CENSO DE APROVECHAMIENTOS SUBTERRÁNEOS
ACUÍFERO 0207 GUADALUPE ","INFORME DEL CENSO DE APROVECHAMIENTOS SUBTERRÁNEOS
ACUÍFERO 0207 GUADALUPE ",,COMISIÓN NACIONAL DEL AGUA (CONAGUA),,1,1,,https://sigagis.conagua.gob.mx/t_estudios24/INVENTARIO/02 BAJA CALIFORNIA/PDF/3137_EC.pdf,BAJA CALIFORNIA
3138,DIGITAL,2006,BAJA CALIFORNIA,"INFORME DEL CENSO DE APROVECHAMIENTOS SUBTERRÁNEOS 
ACUÍFERO 0214 SAN VICENTE","INFORME DEL CENSO DE APROVECHAMIENTOS SUBTERRÁNEOS 
ACUÍFERO 0214 SAN VICENTE",,COMISIÓN NACIONAL DEL AGUA (CONAGUA),,1,1,,https://sigagis.conagua.gob.mx/t_estudios24/INVENTARIO/02 BAJA CALIFORNIA/PDF/3138_EC.pdf,BAJA CALIFORNIA
3143,DIGITAL,1984,MICHOACÁN DE OCAMPO,"ESTUDIO GEOHIDROLÓGICO DEL PROYECTO CUPATITZIO-TEPALCATEPEC, MICHOACÁN","ESTUDIO GEOHIDROLÓGICO DEL PROYECTO CUPATITZIO-TEPALCATEPEC, MICHOACÁN","INGENIERÍA Y SISTEMAS, SOCIEDAD ANÓNIMA (INSISA)",SECRETARÍA DE AGRICULTURA Y RECURSOS HIDRÁULICOS (SARH),IPE-83-2,1,1,,https://sigagis.conagua.gob.mx/t_estudios24/INVENTARIO/16 MICHOACÁN DE OCAMPO/PDF/3143_EC.pdf,MICHOACÁN DE OCAMPO
3147,DIGITAL,1982,MICHOACÁN DE OCAMPO,ESTUDIOS GEOFÍSICOS EN EL ESTADO DE MICHOACÁN,ESTUDIOS GEOFÍSICOS EN EL ESTADO DE MICHOACÁN,"GEOFÍSICA DE EXPLORACIONES GUYSA, SOCIEDAD ANÓNIMA DE CAPITAL VARIABLE",COMISIÓN NACIONAL DEL AGUA (CONAGUA),,1,1,,https://sigagis.conagua.gob.mx/t_estudios24/INVENTARIO/16 MICHOACÁN DE OCAMPO/PDF/3147_EC.pdf,MICHOACÁN DE OCAMPO
3151,AMBOS,1990,GUERRERO OAXACA,"ESTUDIO GEOLÓGICO-ESTRUCTURAL Y DE PROSPECCIÓN GEOHIDROLÓGICA EN LA ZONA DE ZAPOTITLÁN LAGUNAS, ESTADO DE OAXACA","ESTUDIO GEOLÓGICO-ESTRUCTURAL Y DE PROSPECCIÓN GEOHIDROLÓGICA EN LA ZONA DE ZAPOTITLÁN LAGUNAS, ESTADO DE OAXACA","GEOIDE, SOCIEDAD ANÓNIMA DE CAPITAL VARIABLE",SECRETARÍA DE AGRICULTURA Y RECURSOS HIDRÁULICOS (SARH),SGAA-89-50,1,1,https://sigagis.conagua.gob.mx/t_estudios24/INVENTARIO/20 OAXACA/PDF/3151_CC.pdf,https://sigagis.conagua.gob.mx/t_estudios24/INVENTARIO/20 OAXACA/PDF/3151_EC.pdf,OAXACA
3152,DIGITAL,2002,BAJA CALIFORNIA,"PLAN DE MANEJO INTEGRADO DEL AGUA PARA EL ACUÍFERO DE MANEADERO, B. C.","PLAN DE MANEJO INTEGRADO DEL AGUA PARA EL ACUÍFERO DE MANEADERO, BAJA CALIFORNIA",DESARROLLO Y SISTEMAS SOCIEDAD ANÓNIMA DE CAPITAL VARIABLE,COMISIÓN NACIONAL DEL AGUA (CONAGUA),CONTRATO No GAS-010-PRO02,1,1,,https://sigagis.conagua.gob.mx/t_estudios24/INVENTARIO/02 BAJA CALIFORNIA/PDF/3152_EC.pdf,BAJA CALIFORNIA
3153,AMBOS,2002,GUERRERO OAXACA,"ESTUDIO DE ACTUALIZACIÓN DE MEDICIONES PIEZOMÉTRICAS EN LOS ACUÍFEROS DE TEHUANTEPEC, RÍO OSTUTA, NOCHIXTLÁN Y HUATULCO DEL ESTADO DE OAXACA Y CUAJINICUILAPA DEL ESTADO DE GUERRERO ","ESTUDIO DE ACTUALIZACIÓN DE MEDICIONES PIEZOMÉTRICAS EN LOS ACUÍFEROS DE TEHUANTEPEC, RÍO OSTUTA, NOCHIXTLÁN Y HUATULCO DEL ESTADO DE OAXACA Y CUAJINICUILAPA DEL ESTADO DE GUERRERO ",COPEI INGENIERÍA,COMISIÓN NACIONAL DEL AGUA (CONAGUA),SGT-GRPS-OAX-02-047-CEI3,,,https://sigagis.conagua.gob.mx/t_estudios24/INVENTARIO/20 OAXACA/PDF/3153_CC.pdf,https://sigagis.conagua.gob.mx/t_estudios24/INVENTARIO/20 OAXACA/PDF/3153_EC.pdf,OAXACA
3154,DIGITAL,1981,OAXACA,ESTUDIO GEOHIDROLÓGICO PRELIMINAR DE LA CAÑADA POBLANA- OAXAQUEÑA.,ESTUDIO GEOHIDROLÓGICO PRELIMINAR DE LA CAÑADA POBLANA- OAXAQUEÑA.,"PERFORACIONES Y ESTUDIOS GEOLÓGICOS, SOCIEDAD ANÓNIMA (PEGSA)",SECRETARÍA DE AGRICULTURA Y RECURSOS HIDRÁULICOS (SARH),GZA-81-104-GD,1,1,,https://sigagis.conagua.gob.mx/t_estudios24/INVENTARIO/20 OAXACA/PDF/3154_EC.pdf,OAXACA
3158,FÍSICO,2014,AGUASCALIENTES,ESTUDIO DE LA RECARGA ARTIFICIAL DEL ACUÍFERO VALLE DE AGUASCALIENTES ETAPA 1 y 2,ESTUDIO DE LA RECARGA ARTIFICIAL DEL ACUÍFERO 0101 VALLE DE AGUASCALIENTES ETAPA 1,ALPHA,INSTITUTO DEL AGUA DEL ESTADO DE AGUASCALIENTES,,1,2,https://sigagis.conagua.gob.mx/t_estudios24/INVENTARIO/01 AGUASCALIENTES/PDF/3158_CC.pdf,,AGUASCALIENTES
3159,FÍSICO,1996,CIUDAD DE MÉXICO MÉXICO,"DISEÑO DE REDES DE MONITOREO DE LOS ACUÍFEROS DE LOS VALLES DE PACHUCA-TIZAYUCA, TEXCOCO, CHALCO-AMECAMECA Y LA CIUDAD DE MÉXICO, EN EL VALLE DE MÉXICO
","DISEÑO DE REDES DE MONITOREO DE LOS ACUÍFEROS DE LOS VALLES DE 1508 CUAUTITLÁN - PACHUCA, TIZAYUCA, 1507 TEXCOCO, 1506 CHALCO - AMECAMECA Y LA CIUDAD DE MÉXICO, EN EL VALLE DE MÉXICO, CIUDAD DE MÉXICO, ACUÍFERO 0901 ZONA METROPOLITANA DE LA CIUDAD DE MÉXICO
","CONSULTEC, INGENIEROS ASOCIADOS, SOCIEDAD CIVIL",DEPARTAMENTO DEL DISTRITO FEDERAL (DDF),,1,1,https://sigagis.conagua.gob.mx/t_estudios24/INVENTARIO/09 CIUDAD DE MÉXICO/PDF/3159_CC.pdf,,CIUDAD DE MÉXICO
3160,AMBOS,2001,AGUASCALIENTES,"ESTUDIO DE MANEJO DE LA DEMANDA DE AGUA PARA LA ESTABILIZACIÓN DEL ACUÍFERO VALLE DE AGUASCALIENTES
RESUMEN EJECUTIVO","ESTUDIO DE MANEJO DE LA DEMANDA DE AGUA PARA LA ESTABILIZACIÓN DEL ACUÍFERO 0101 VALLE DE AGUASCALIENTES
RESUMEN EJECUTIVO","DESARROLLO Y SISTEMAS, SOCIEDAD ANÓNIMA",COMISIÓN NACIONAL DEL AGUA (CONAGUA),,1,1,https://sigagis.conagua.gob.mx/t_estudios24/INVENTARIO/01 AGUASCALIENTES/PDF/3160_CC.pdf,https://sigagis.conagua.gob.mx/t_estudios24/INVENTARIO/01 AGUASCALIENTES/PDF/3160_EC.pdf,AGUASCALIENTES
3162,DIGITAL,2011,BAJA CALIFORNIA SUR,"ESTUDIO PARA EL MONITOREO, CONSERVACIÓN Y MANEJO DE LOS RECURSOS NATURALES PRIMERA PARTE DE ESTUDIO HIDROLÓGICO DEL VALLE DE VIZCAÍNO: MODELO CONCEPTUAL Y ANÁLISIS PIEZOMÉTRICO, ACUÍFERO VIZCAÍNO, BCS","ESTUDIO PARA EL MONITOREO, CONSERVACIÓN Y MANEJO DE LOS RECURSOS NATURALES PRIMERA PARTE DE ESTUDIO HIDROLÓGICO DEL VALLE DE VIZCAÍNO: MODELO CONCEPTUAL Y ANÁLISIS PIEZOMÉTRICO, ACUÍFERO VIZCAÍNO, BAJA CALIFORNIA SUR",INSTITUTO MEXICANO DE TECNOLOGÍA DEL AGUA (IMTA),COMISIÓN NACIONAL DEL AGUA (CONAGUA),CONVENIO DE COLABORACIÓN CONANP/DR01/003/RB05/PROCODES/42/10,1,1,,https://sigagis.conagua.gob.mx/t_estudios24/INVENTARIO/03 BAJA CALIFORNIA SUR/PDF/3162_EC.pdf,BAJA CALIFORNIA SUR
3165,DIGITAL,2002,YUCATÁN,ESTUDIO HIDROGEOLÓGICO DEL ESTADO DE YUCATÁN,ESTUDIO HIDROGEOLÓGICO DEL ESTADO DE YUCATÁN_INEGI,,"INSTITUTO NACIONAL DE ESTADÍSTICA, GEOGRAFÍA E INFORMÁTICA (INEGI)",,1,1,https://sigagis.conagua.gob.mx/t_estudios24/INVENTARIO/31 YUCATÁN/PDF/3165_CC.pdf,https://sigagis.conagua.gob.mx/t_estudios24/INVENTARIO/31 YUCATÁN/PDF/3165_EC.pdf,YUCATÁN
3167,DIGITAL,1981,PUEBLA,ACTUALIZACIÓN DE ESTUDIOS GEOHIDROLÓGICOS EN DIVERSAS ZONAS DEL ESTADO DE PUEBLA.,ACTUALIZACIÓN DE ESTUDIOS GEOHIDROLÓGICOS EN DIVERSAS ZONAS DEL ESTADO DE PUEBLA.,"PERFORACIONES Y ESTUDIOS GEOLÓGICOS, SOCIEDAD ANÓNIMA (PEGSA)",SECRETARÍA DE AGRICULTURA Y RECURSOS HIDRÁULICOS (SARH),GZA-79-76-GD,1,1,,https://sigagis.conagua.gob.mx/t_estudios24/INVENTARIO/21 PUEBLA/PDF/3167_EC.pdf,PUEBLA
3168,DIGITAL,1985,PUEBLA,"ESTUDIO GEOHIDROLÓGICO BÁSICO DEL PROYECTO NEALTICAN, PUE.","ESTUDIO GEOHIDROLÓGICO BÁSICO DEL PROYECTO NEALTICAN, PUE.","CALOMEL, SOCIEDAD ANÓNIMA DE CAPITAL VARIABLE",SISTEMA OPERADOR DE LOS SERVICIOS DE AGUA POTABLE Y ALCANTARILLADO EN EL MUNICIPIO DE PUEBLA (SOAPAP),,1,1,,https://sigagis.conagua.gob.mx/t_estudios24/INVENTARIO/21 PUEBLA/PDF/3168_EC.pdf,PUEBLA
3169,DIGITAL,1989,PUEBLA,"ESTUDIO GEOHIDROLÓGICO Y GEOFÍSICO, REALIZADO EN LOS TERRENOS DE LA EXHACIENDA LA CARCAÑA PERTENECIENTE AL MUNICIPIO DE SAN PEDRO CHOLULA, PUEBLA","ESTUDIO GEOHIDROLÓGICO Y GEOFÍSICO, REALIZADO EN LOS TERRENOS DE LA EXHACIENDA LA CARCAÑA PERTENECIENTE AL MUNICIPIO DE SAN PEDRO CHOLULA, PUEBLA",,SISTEMA OPERADOR DE LOS SERVICIOS DE AGUA POTABLE Y ALCANTARILLADO EN EL MUNICIPIO DE PUEBLA (SOAPAP),,1,1,,https://sigagis.conagua.gob.mx/t_estudios24/INVENTARIO/21 PUEBLA/PDF/3169_EC.pdf,PUEBLA
3170,DIGITAL,1980,PUEBLA,"SERVICIOS DE PROSPECCIÓN Y LEVANTAMIENTOS GEOLÓGICOS Y GEOFÍSICOS EN LA ZONA DE CHAUTLA-TULCINGO, EN LA PORCIÓN SUROCCIDENTAL DEL ESTADO DE PUEBLA","SERVICIOS DE PROSPECCIÓN Y LEVANTAMIENTOS GEOLÓGICOS Y GEOFÍSICOS EN LA ZONA DE CHAUTLA-TULCINGO, EN LA PORCIÓN SUROCCIDENTAL DEL ESTADO DE PUEBLA","PERFORACIONES Y ESTUDIOS GEOLÓGICOS, SOCIEDAD ANÓNIMA (PEGSA)",SECRETARÍA DE AGRICULTURA Y RECURSOS HIDRÁULICOS (SARH),,1,1,,https://sigagis.conagua.gob.mx/t_estudios24/INVENTARIO/21 PUEBLA/PDF/3170_EC.pdf,PUEBLA
3171,DIGITAL,1981,PUEBLA,ACTUALIZACIÓN DEL ESTUDIO GEOHIDROLÓGICO EN EL VALLE DE PUEBLA.,ACTUALIZACIÓN DEL ESTUDIO GEOHIDROLÓGICO EN EL VALLE DE PUEBLA.,"PERFORACIONES Y ESTUDIOS GEOLÓGICOS, SOCIEDAD ANÓNIMA (PEGSA)",SECRETARÍA DE AGRICULTURA Y RECURSOS HIDRÁULICOS (SARH),GZA-80-19-GD,1,1,,https://sigagis.conagua.gob.mx/t_estudios24/INVENTARIO/21 PUEBLA/PDF/3171_EC.pdf,PUEBLA
3172,DIGITAL,1985,PUEBLA,"ESTUDIO DE PROSPECCIÓN GEOHIDROLÓGICA EN EL ÁREA DE SAN JUAN AMECAC, MUNICIPIO DE ATZITZIHUACAN","ESTUDIO DE PROSPECCIÓN GEOHIDROLÓGICA EN EL ÁREA DE SAN JUAN AMECAC, MUNICIPIO DE ATZITZIHUACAN",,SECRETARÍA DE AGRICULTURA Y RECURSOS HIDRÁULICOS (SARH),,1,1,,https://sigagis.conagua.gob.mx/t_estudios24/INVENTARIO/21 PUEBLA/PDF/3172_EC.pdf,PUEBLA
3173,DIGITAL,,PUEBLA,ESTUDIO GEHIDROLÓGICO SUBCUENCA DE MOCTEZUMA,ESTUDIO GEHIDROLÓGICO SUBCUENCA DE MOCTEZUMA,"GEÓLOGOS CONSULTORES, SOCIEDAD ANÓNIMA",COMISIÓN NACIONAL DEL AGUA (CONAGUA),,1,1,,https://sigagis.conagua.gob.mx/t_estudios24/INVENTARIO/21 PUEBLA/PDF/3173_EC.pdf,PUEBLA
