ID_ESTUDIOS,ESTATUS DE ESTUDIO,AÑO,ESTADOS,TITULO_ORIGINAL,TITULO_BUSQUEDA,EMPRESA,FUENTE,CONTRATO,EJEMPLARES,TOMOS,CARATULA,PDF,ESTADO_ARCHIVOS
680,FÍSICO,1980,SONORA,"INFORME DE LA PROSPECCIÓN Y LEVANTAMIENTOS GEOLÓGICOS Y GEOFÍSICOS EN EL ÁREA DE CABORCA, SON.","INFORME DE LA PROSPECCIÓN Y LEVANTAMIENTOS GEOLÓGICOS Y GEOFÍSICOS EN EL ÁREA DE CABORCA, SONORA","GEOEXPLORACIONES Y CONSTRUCCIONES, SOCIEDAD ANÓNIMA (GYCSA)",SECRETARÍA DE AGRICULTURA Y RECURSOS HIDRÁULICOS (SARH),GZA-79-3-ED,1,1,https://sigagis.conagua.gob.mx/t_estudios24/INVENTARIO/26 SONORA/PDF/0680_CC.pdf,,SONORA
681,FÍSICO,1981,MORELOS,"SERVICIOS DE PROSPECCIÓN Y LEVANTAMIENTOS GEOLÓGICOS Y GEOFÍSICOS EN LA ZONA DE CUAUTLA, ZACUALPAN, DE AMILPAS OCUITUCO, EN LA PORCIÓN NORIENTAL DEL ESTADO DE MORELOS.
","SERVICIOS DE PROSPECCIÓN Y LEVANTAMIENTOS GEOLÓGICOS Y GEOFÍSICOS EN LA ZONA DE CUAUTLA, ZACUALPAN, DE AMILPAS OCUITUCO, EN LA PORCIÓN NORIENTAL DEL ESTADO DE MORELOS.
","INVESTIGACIONES Y ESTUDIOS DE LA TIERRA, SOCIEDAD ANÓNIMA (IETSA)",SECRETARÍA DE AGRICULTURA Y RECURSOS HIDRÁULICOS (SARH),GZA-81-39-ED,1,1,https://sigagis.conagua.gob.mx/t_estudios24/INVENTARIO/17 MORELOS/PDF/0681_CC.pdf,,MORELOS
682,AMBOS,1974,NAYARIT,ESTUDIO GEOHIDROLÓGICO PRELIMINAR DE LA ZONA COSTERA DEL ESTADO DE NAYARIT,ESTUDIO GEOHIDROLÓGICO PRELIMINAR DE LA ZONA COSTERA DEL ESTADO DE NAYARIT,"SERVICIOS GEOLÓGICOS, SOCIEDAD ANÓNIMA",SECRETARÍA DE RECURSOS HIDRÁULICOS (SRH),EIGZA-74-25,1,1,https://sigagis.conagua.gob.mx/t_estudios24/INVENTARIO/18 NAYARIT/PDF/0682_CC.pdf,https://sigagis.conagua.gob.mx/t_estudios24/INVENTARIO/18 NAYARIT/PDF/0682_EC.pdf,NAYARIT
683,AMBOS,1980,JALISCO NAYARIT,"MODELO MATEMÁTICO DEL ACUÍFERO DEL VALLE DE BANDERAS, JALISCO","MODELO MATEMÁTICO DEL ACUÍFERO DEL VALLE DE BANDERAS, JALISCO","GEOCALLI, SOCIEDAD ANÓNIMA",SECRETARÍA DE AGRICULTURA Y RECURSOS HIDRÁULICOS (SARH),GZA-80-12-GD,1,1,https://sigagis.conagua.gob.mx/t_estudios24/INVENTARIO/14 JALISCO/PDF/0683_CC.pdf,https://sigagis.conagua.gob.mx/t_estudios24/INVENTARIO/14 JALISCO/PDF/0683_EC.pdf,JALISCO
684,AMBOS,1981,NAYARIT,"SERVICIOS DE PROSPECCIÓN Y LEVANTAMIENTOS GEOLÓGICOS Y GEOFÍSICOS EN LA ZONA DEL VALLE DEL RÍO SAN PEDRO, ESTADO DE NAYARIT.","SERVICIOS DE PROSPECCIÓN Y LEVANTAMIENTOS GEOLÓGICOS Y GEOFÍSICOS EN LA ZONA DEL VALLE DEL 1802 SAN PEDRO TUXPAN, ESTADO DE NAYARIT.","ROCHA Y ASOCIADOS, SOCIEDAD ANÓNIMA (ROASA)",SECRETARÍA DE AGRICULTURA Y RECURSOS HIDRÁULICOS (SARH),GZA-81-17-ED,2 EJEMPLARES DEL TOMO I,TOMO I,https://sigagis.conagua.gob.mx/t_estudios24/INVENTARIO/18 NAYARIT/PDF/0684_CC.pdf,https://sigagis.conagua.gob.mx/t_estudios24/INVENTARIO/18 NAYARIT/PDF/0684_EC.pdf,NAYARIT
685,AMBOS,1981,NAYARIT,"ESTUDIOS GEOHIDROLÓGICO PRELIMINAR DE LA ZONAS DE ACAPONETA-IXTLÁN DEL RÍO, NAYARIT.","ESTUDIOS GEOHIDROLÓGICO PRELIMINAR DE LA ZONAS DE 1801 VALLE ACAPONETA - CAÑAS, 1809 VALLE IXTLÁN - AHUACATLÁN, ESTADO DE NAYARIT.",PROYESA,SECRETARÍA DE AGRICULTURA Y RECURSOS HIDRÁULICOS (SARH),GZA-81-77-GD,1,1,https://sigagis.conagua.gob.mx/t_estudios24/INVENTARIO/18 NAYARIT/PDF/0685_CC.pdf,https://sigagis.conagua.gob.mx/t_estudios24/INVENTARIO/18 NAYARIT/PDF/0685_EC.pdf,NAYARIT
686,DIGITAL,1991,NUEVO LEÓN,"ESTUDIO HIDROGEOLÓGICO DE LOS HERRERAS-LOS ALDAMAS
ESTADO DE NUEVO LEÓN",ESTUDIO DE LOS HERRERAS-LOS ALDAMAS ESTADO DE NUEVO LEÓN,,COMISIÓN NACIONAL DEL AGUA (CONAGUA),,1,1,,https://sigagis.conagua.gob.mx/t_estudios24/INVENTARIO/19 NUEVO LEÓN/PDF/0686_EC.pdf,NUEVO LEÓN
687,DIGITAL,2012,QUERÉTARO,REMEDIACIÓN DE LAS ZONAS SATURADAS Y NO SATURADA DE LA TERMINAL DE ALMACENAMIENTO Y REPARTO DE QUERÉTARO,REMEDIACIÓN DE LAS ZONAS SATURADAS Y NO SATURADA DE LA TERMINAL DE ALMACENAMIENTO Y REPARTO DE QUERÉTARO,INSTITUTO POLITÉCNICO NACIONAL (IPN),PETRÓLEOS MEXICANOS (PEMEX),,1,1,,https://sigagis.conagua.gob.mx/t_estudios24/INVENTARIO/22 QUERÉTARO/PDF/0687_EC.pdf,QUERÉTARO
688,AMBOS,1980,NAYARIT,"SERVICIOS DE PROSPECCIÓN Y LEVANTAMIENTOS GEOLÓGICOS Y GEOFÍSICOS EN LAS ZONA IXTLÁN-COMPOSTELA-SANTIAGO, ESTADO DE NAYARIT.","SERVICIOS DE PROSPECCIÓN Y LEVANTAMIENTOS GEOLÓGICOS Y GEOFÍSICOS EN LAS ZONA IXTLÁN-COMPOSTELA-SANTIAGO, ESTADO DE NAYARIT, 1809 VALLE IXTLÁN - AHUACATLÁN, 1805 VALLE DE COMPOSTELA","TÉCNICOS ASESORES Y CONSTRUCTORES, SOCIEDAD ANÓNIMA (TACSA)",SECRETARÍA DE AGRICULTURA Y RECURSOS HIDRÁULICOS (SARH),GZA-80-32-ED,1,2,https://sigagis.conagua.gob.mx/t_estudios24/INVENTARIO/18 NAYARIT/PDF/0688_CC.pdf,https://sigagis.conagua.gob.mx/t_estudios24/INVENTARIO/18 NAYARIT/PDF/0688_EC.pdf,NAYARIT
689,AMBOS,1980,NAYARIT,"SERVICIOS DE PROSPECCIÓN Y LEVANTAMIENTOS GEOLÓGICO Y GEOFÍSICOS EN SANTIAGO-SAN BLAS, ESTADO DE NAYARIT.","SERVICIOS DE PROSPECCIÓN Y LEVANTAMIENTOS GEOLÓGICO Y GEOFÍSICOS EN SANTIAGO-SAN BLAS, ESTADO DE NAYARIT, 1807 VALLE DE BANDERAS","INGEO, SOCIEDAD CIVIL",SECRETARÍA DE AGRICULTURA Y RECURSOS HIDRÁULICOS (SARH),GZA-80-91-ED,1,1,https://sigagis.conagua.gob.mx/t_estudios24/INVENTARIO/18 NAYARIT/PDF/0689_CC.pdf,https://sigagis.conagua.gob.mx/t_estudios24/INVENTARIO/18 NAYARIT/PDF/0689_EC.pdf,NAYARIT
690,FÍSICO,1990,HIDALGO MORELOS,"MÉTODOS, PROCESOS E INTERPRETACIÓN AUTOMÁTICAS DE GEOFÍSICA DE RESISTIVIDAD EN LA EXPLORACIÓN GEOHIDROLÓGICA
","MÉTODOS, PROCESOS E INTERPRETACIÓN AUTOMÁTICAS DE GEOFÍSICA DE RESISTIVIDAD EN LA EXPLORACIÓN GEOHIDROLÓGICA
",UNIVERSIDAD NACIONAL AUTÓNOMA DE MÉXICO (UNAM),COMISIÓN NACIONAL DEL AGUA (CONAGUA),SGAA-89-33,1,2,https://sigagis.conagua.gob.mx/t_estudios24/INVENTARIO/17 MORELOS/PDF/0690_CC.pdf,,MORELOS
691,FÍSICO,1997,SONORA,"ALTERNATIVAS PARA REDUCIR LA PRESENCIA DE FIERRO Y MANGANESO QUE EXCEDA LOS LÍMITES ESTABLECIDOS EN LAS NORMAS PARA EL AGUA POTABLE, EN EL ABASTECIMIENTO DE LA ZONA DE GUAYMAS-EMPALME
INFORME FINAL","ALTERNATIVAS PARA REDUCIR LA PRESENCIA DE FIERRO Y MANGANESO QUE EXCEDA LOS LÍMITES ESTABLECIDOS EN LAS NORMAS PARA EL AGUA POTABLE, EN EL ABASTECIMIENTO DE LA ZONA DE GUAYMAS-EMPALME
INFORME FINAL",INSTITUTO TECNOLÓGICO DE SONORA (ITSON),COMISIÓN NACIONAL DEL AGUA (CONAGUA),,1,1,https://sigagis.conagua.gob.mx/t_estudios24/INVENTARIO/26 SONORA/PDF/0691_CC.pdf,,SONORA
692,AMBOS,1986,NAYARIT,ACTUALIZACIÓN DE CONDICIONES PIEZOMÉTRICAS ZONA DEL VALLE MATATIPAC ESTADO DE NAYARIT.,"ACTUALIZACIÓN DE CONDICIONES PIEZOMÉTRICAS ZONA DEL VALLE MATATIPAC ESTADO DE NAYARIT, 1804 VALLE DE MATATIPAC",,SECRETARÍA DE AGRICULTURA Y RECURSOS HIDRÁULICOS (SARH),,1,1,https://sigagis.conagua.gob.mx/t_estudios24/INVENTARIO/18 NAYARIT/PDF/0692_CC.pdf,https://sigagis.conagua.gob.mx/t_estudios24/INVENTARIO/18 NAYARIT/PDF/0692_EC.pdf,NAYARIT
693,DIGITAL,1975,VERACRUZ DE IGNACIO DE LA LLAVE,"CENSO NACIONAL DE APROVECHAMIENTOS DE AGUA SUBTERRÁNEA VER.
PLANICIE COSTERA DEL RÍO COATZACOALCOS, VER.","CENSO NACIONAL DE APROVECHAMIENTOS DE AGUA SUBTERRÁNEA VERACRUZ
PLANICIE COSTERA DEL RÍO COATZACOALCOS, VERACRUZ",,SECRETARÍA DE RECURSOS HIDRÁULICOS (SRH),,1,1,,https://sigagis.conagua.gob.mx/t_estudios24/INVENTARIO/30 VERACRUZ DE IGNACIO DE LA LLAVE/PDF/0693_EC.pdf,VERACRUZ DE IGNACIO DE LA LLAVE
694,DIGITAL,1985,NAYARIT,"ESTUDIO DE LA ACTUALIZACIÓN DE LAS CONDICIONES PIEZOMÉTRICAS
ZONAS DE ACAPONETA-CAÑAS","ESTUDIO DE LA ACTUALIZACIÓN DE LAS CONDICIONES PIEZOMÉTRICAS
ZONAS DE ACAPONETA-CAÑAS, 1801 VALLE ACAPONETA - CAÑAS",,SECRETARÍA DE AGRICULTURA Y RECURSOS HIDRÁULICOS (SARH),,1,1,https://sigagis.conagua.gob.mx/t_estudios24/INVENTARIO/18 NAYARIT/PDF/0694_CC.pdf,https://sigagis.conagua.gob.mx/t_estudios24/INVENTARIO/18 NAYARIT/PDF/0694_EC.pdf,NAYARIT
695,DIGITAL,1992,GUANAJUATO,"ESTUDIO GEOFÍSICO EN EL RANCHO ""LA BEGOÑA"" MUNICIPIO DE DOCTOR MORA, GUANAJUATO
REGISTRO ELÉCTRICOS DE POZOS Y LITOLOGÍA","ESTUDIO GEOFÍSICO EN EL RANCHO ""LA BEGOÑA"" MUNICIPIO DE DOCTOR MORA, GUANAJUATO
REGISTRO ELÉCTRICOS DE POZOS Y LITOLOGÍA",UNIVERSIDAD NACIONAL AUTÓNOMA DE MÉXICO (UNAM) CHECAR,COMISIÓN NACIONAL DEL AGUA (CONAGUA) CHECAR,,1,1,,https://sigagis.conagua.gob.mx/t_estudios24/INVENTARIO/11 GUANAJUATO/PDF/0695_EC.pdf,GUANAJUATO
696,DIGITAL,1988,GUANAJUATO,"ESTUDIO DE EXPLORACIÓN GEOFÍSICA Y ACTIVIDADES GEOHIDROLÓGICAS COMPLEMENTARIAS EN LA ZONA SUR DE LEÓN
COMPLEMENTARIAS EN LA ZONA SUR DE LEÓN","ESTUDIO DE EXPLORACIÓN GEOFÍSICA Y ACTIVIDADES GEOHIDROLÓGICAS COMPLEMENTARIAS EN LA ZONA SUR DE LEÓN
COMPLEMENTARIAS EN LA ZONA SUR DE LEÓN","GEOFÍSICA DE EXPLORACIONES GUYSA, SOCIEDAD ANÓNIMA DE CAPITAL VARIABLE",SECRETARÍA DE AGRICULTURA Y RECURSOS HIDRÁULICOS (SARH),ACSH-03-88,1,1,,https://sigagis.conagua.gob.mx/t_estudios24/INVENTARIO/11 GUANAJUATO/PDF/0696_EC.pdf,GUANAJUATO
697,AMBOS,1981,NAYARIT,"ESTUDIO FOTOGEOLÓGICO EN LA ZONA DE SANTA MARIA DEL ORO, ESTADO DE NAYARIT.","ESTUDIO FOTOGEOLÓGICO EN LA ZONA DE SANTA MARIA DEL ORO, ESTADO DE NAYARIT, 1812 VALLE DE SANTA MARIA DEL ORO","INGEO, SOCIEDAD CIVIL",SECRETARÍA DE AGRICULTURA Y RECURSOS HIDRÁULICOS (SARH),GZA-81-158-FD,1,1,https://sigagis.conagua.gob.mx/t_estudios24/INVENTARIO/18 NAYARIT/PDF/0697_CC.pdf,https://sigagis.conagua.gob.mx/t_estudios24/INVENTARIO/18 NAYARIT/PDF/0697_EC.pdf,NAYARIT
698,AMBOS,1985,NAYARIT,"INVENTARIO FÍSICO DE LOS USOS AGUA EN LAS CUENCAS DE LOS RÍOS SAN PEDRO, ACAPONETA, SANTIAGO AGUAMILPA Y HUICICILA-SAN BLAS, EN EL ESTADO DE NAYARIT","INVENTARIO FÍSICO DE LOS USOS AGUA EN LAS CUENCAS DE LOS RÍOS SAN PEDRO, ACAPONETA, SANTIAGO AGUAMILPA Y HUICICILA-SAN BLAS, EN EL ESTADO DE NAYARIT, 1802 SAN PEDRO - TUXPAN, 1801 VALLE ACAPONETA - CAÑAS, 1803 VALLE SANTIAGO - SAN BLAS","EXPLORACIONES COORDINADAS, SOCIEDAD ANÓNIMA DE CAPITAL VARIABLE",SECRETARÍA DE AGRICULTURA Y RECURSOS HIDRÁULICOS (SARH),SIH-85-03,1,2,https://sigagis.conagua.gob.mx/t_estudios24/INVENTARIO/18 NAYARIT/PDF/0698_CC.pdf,https://sigagis.conagua.gob.mx/t_estudios24/INVENTARIO/18 NAYARIT/PDF/0698_EC.pdf,NAYARIT
699,DIGITAL,1980,NAYARIT,"ESTUDIO GEOHIDROLÓGICO PRELIMINAR DE LAS ZONAS DE MATATIPAC-ZACUALPAN Y LAS VARAS, NAYARIT
TOMO I","ESTUDIO GEOHIDROLÓGICO PRELIMINAR DE LAS ZONAS DE MATATIPAC-ZACUALPAN Y LAS VARAS, ESTADO DE NAYARIT
TOMO I, 1804 VALLE DE MATATIPAC","ROCHA Y ASOCIADOS, SOCIEDAD ANÓNIMA (ROASA)",SECRETARÍA DE AGRICULTURA Y RECURSOS HIDRÁULICOS (SARH),,1,1,https://sigagis.conagua.gob.mx/t_estudios24/INVENTARIO/18 NAYARIT/PDF/0699_CC.pdf,https://sigagis.conagua.gob.mx/t_estudios24/INVENTARIO/18 NAYARIT/PDF/0699_EC.pdf,NAYARIT
700,AMBOS,1993,NUEVO LEÓN,SINOPSIS GEOHIDROLÓGICA DEL ESTADO DE NUEVO LEÓN.,SINOPSIS GEOHIDROLÓGICA DEL ESTADO DE NUEVO LEÓN.,SECRETARÍA DE AGRICULTURA Y RECURSOS HIDRÁULICOS (SARH),SECRETARÍA DE AGRICULTURA Y RECURSOS HIDRÁULICOS (SARH),,1,1,https://sigagis.conagua.gob.mx/t_estudios24/INVENTARIO/19 NUEVO LEÓN/PDF/0700_CC.pdf,https://sigagis.conagua.gob.mx/t_estudios24/INVENTARIO/19 NUEVO LEÓN/PDF/0700_EC.pdf,NUEVO LEÓN
701,AMBOS,1973,NUEVO LEÓN,ESTUDIO GEOHIDROLÓGICO DEL ESTADO DE NUEVO LEÓN,ESTUDIO GEOHIDROLÓGICO DEL ESTADO DE NUEVO LEÓN,"INGENIERÍA Y SISTEMAS, SOCIEDAD ANÓNIMA (INSISA)",SECRETARÍA DE RECURSOS HIDRÁULICOS (SRH),,1,"5 DE 6 TOMOS, FALTA TOMO 1",https://sigagis.conagua.gob.mx/t_estudios24/INVENTARIO/19 NUEVO LEÓN/PDF/0701_CC.pdf,https://sigagis.conagua.gob.mx/t_estudios24/INVENTARIO/19 NUEVO LEÓN/PDF/0701_EC.pdf,NUEVO LEÓN
702,AMBOS,1997,MÉXICO,ACTUALIZACIÓN DE MEDICIONES PIEZOMÉTRICAS DE LOS ACUÍFEROS REACTIVADOS EN LOS VALLES DE TOLUCA Y ATLACOMULCO-IXTLAHUACA EN EL ESTADO DE MÉXICO,ACTUALIZACIÓN DE MEDICIONES PIEZOMÉTRICAS DE LOS ACUÍFEROS REACTIVADOS EN LOS VALLES DE TOLUCA Y ATLACOMULCO-IXTLAHUACA EN EL ESTADO DE MÉXICO,"UNITECNIA, SOCIEDAD ANÓNIMA DE CAPITAL VARIABLE",COMISIÓN NACIONAL DEL AGUA (CONAGUA),GAS-019-PRO-97,1,1,,https://sigagis.conagua.gob.mx/t_estudios24/INVENTARIO/15 MÉXICO/PDF/0702_EC.pdf,MÉXICO
703,AMBOS,1969,NUEVO LEÓN,"ESTUDIO GEOHIDROLÓGICO DE LOS ACUÍFEROS REGIONALES EN CALIZAS, ZONA DE MONTERREY","ESTUDIO GEOHIDROLÓGICO DE LOS ACUÍFEROS REGIONALES EN CALIZAS, ZONA DE MONTERREY",CIEPS INGENIEROS CONSULTORES Y PROYECTISTAS,SECRETARÍA DE RECURSOS HIDRÁULICOS (SRH),,1,1,,,NUEVO LEÓN
704,FÍSICO,1992,MÉXICO,"ESTUDIO PARA EL DIAGNÓSTICO DEL ACUÍFERO DEL VALLE DE TOLUCA, PARA IMPLEMENTAR LA REGLAMENTACIÓN DE LA EXTRACCIÓN DE AGUA SUBTERRÁNEA","ESTUDIO PARA EL DIAGNÓSTICO DEL ACUÍFERO DEL VALLE DE TOLUCA, PARA IMPLEMENTAR LA REGLAMENTACIÓN DE LA EXTRACCIÓN DE AGUA SUBTERRÁNEA","LESSER Y ASOCIADOS, SOCIEDAD ANÓNIMA DE CAPITAL VARIABLE",GOBIERNO DEL ESTADO DE MÉXICO,,1,1,,https://sigagis.conagua.gob.mx/t_estudios24/INVENTARIO/15 MÉXICO/PDF/0704_EC.pdf,MÉXICO
708,FÍSICO,1974,NUEVO LEÓN,ESTUDIO GEOHIDROLÓGICO DEL ÁREA METROPOLITANA DE MONTERREY,ESTUDIO GEOHIDROLÓGICO DEL ÁREA METROPOLITANA DE MONTERREY,,SECRETARÍA DE RECURSOS HIDRÁULICOS (SRH),,,,https://sigagis.conagua.gob.mx/t_estudios24/INVENTARIO/19 NUEVO LEÓN/PDF/0708_CC.pdf,,NUEVO LEÓN
710,DIGITAL,1992,NUEVO LEÓN,"ESTUDIO INTEGRAL DE LOS RECURSOS HIDRÁULICO PARA EL ABASTECIMIENTO DE AGUA POTABLE EN LA CIUDAD MONTERREY, N.L. Y SU ÁREA METROPOLITANA","ESTUDIO INTEGRAL DE LOS RECURSOS HIDRÁULICO PARA EL ABASTECIMIENTO DE AGUA POTABLE EN LA CIUDAD MONTERREY, N.L. Y SU ÁREA METROPOLITANA","TGC GEOTECNIA, SOCIEDAD ANÓNIMA DE CAPITAL VARIABLE",COMISIÓN NACIONAL DEL AGUA (CONAGUA),,1,1,,https://sigagis.conagua.gob.mx/t_estudios24/INVENTARIO/19 NUEVO LEÓN/PDF/0710_EC.pdf,NUEVO LEÓN
711,AMBOS,1979,NUEVO LEÓN,"SERVICIOS DE PROSPECCIÓN Y LEVANTAMIENTO GEOLÓGICO Y GEOFÍSICO EN LA ZONA DE BUSTAMANTE, NUEVO LEÓN.","SERVICIOS DE PROSPECCIÓN Y LEVANTAMIENTO GEOLÓGICO Y GEOFÍSICO EN LA ZONA DE BUSTAMANTE, NUEVO LEÓN.","INGEO, SOCIEDAD CIVIL",SECRETARÍA DE AGRICULTURA Y RECURSOS HIDRÁULICOS (SARH),GZA-79-59-ED,1,1,https://sigagis.conagua.gob.mx/t_estudios24/INVENTARIO/19 NUEVO LEÓN/PDF/0711_CC.pdf,https://sigagis.conagua.gob.mx/t_estudios24/INVENTARIO/19 NUEVO LEÓN/PDF/0711_EC.pdf,NUEVO LEÓN
712,AMBOS,1979,NUEVO LEÓN,"SERVICIOS DE PROSPECCIÓN Y LEVANTAMIENTOS GEOLÓGICOS Y GEOFÍSICOS EN LA ZONA DE GALEANA, ESTADO DE NUEVO LEÓN.","SERVICIOS DE PROSPECCIÓN Y LEVANTAMIENTOS GEOLÓGICOS Y GEOFÍSICOS EN LA ZONA DE GALEANA, ESTADO DE NUEVO LEÓN.","HIDROGEOLOGÍA, SOCIEDAD ANÓNIMA",SECRETARÍA DE AGRICULTURA Y RECURSOS HIDRÁULICOS (SARH),GZA-79-10-ED,1,1,https://sigagis.conagua.gob.mx/t_estudios24/INVENTARIO/19 NUEVO LEÓN/PDF/0712_CC.pdf,https://sigagis.conagua.gob.mx/t_estudios24/INVENTARIO/19 NUEVO LEÓN/PDF/0712_EC.pdf,NUEVO LEÓN
713,DIGITAL,1977,NUEVO LEÓN,ESTUDIO AGROLÓGICO Y GEOHIDROLÓGICO DE LA ZONA DEL CUIJE-POTOSÍ-RAÍCES DEL ESTADO DE NUEVO LEÓN.,ESTUDIO AGROLÓGICO Y GEOHIDROLÓGICO DE LA ZONA DEL CUIJE-POTOSÍ-RAÍCES DEL ESTADO DE NUEVO LEÓN.,"INGENIERÍA Y GEOTECNIA, SOCIEDAD ANÓNIMA (INGESA)","EJIDOS DEL CUIJE, CATARINO RODRÍGUEZ, RÍO VERDE, EL CRISTAL Y TOKIO",,1,1,,https://sigagis.conagua.gob.mx/t_estudios24/INVENTARIO/19 NUEVO LEÓN/PDF/0713_EC.pdf,NUEVO LEÓN
715,DIGITAL,1982,NUEVO LEÓN,"ACUEDUCTO MONTERREY LINARES
PROSPECCIÓN GEOFÍSICA","ACUEDUCTO MONTERREY LINARES
PROSPECCIÓN GEOFÍSICA","CONSULTORES EN AGUA SUBTERRÁNEA, SOCIEDAD ANÓNIMA",SECRETARÍA DE AGRICULTURA Y RECURSOS HIDRÁULICOS (SARH),,1,1,,https://sigagis.conagua.gob.mx/t_estudios24/INVENTARIO/19 NUEVO LEÓN/PDF/0715_EC.pdf,NUEVO LEÓN
716,FÍSICO,1996,CHIHUAHUA,"SIMULACIÓN HIDRODINÁMICA EN DEL ACUÍFERO DE EL SAUZ-ENCINILLAS, CHIHUAHUA","SIMULACIÓN HIDRODINÁMICA EN DEL ACUÍFERO DE EL SAUZ-ENCINILLAS, CHIHUAHUA","INGENIERÍA DE EVALUACIÓN Y PROSPECCIÓN, SOCIEDAD ANÓNIMA DE CAPITAL VARIABLE (IEPSA)",COMISIÓN NACIONAL DEL AGUA (CONAGUA),GAS-007-96,1,2,https://sigagis.conagua.gob.mx/t_estudios24/INVENTARIO/08 CHIHUAHUA/PDF/0716_CC.pdf,,CHIHUAHUA
718,AMBOS,1981,NUEVO LEÓN,"ESTUDIO GEOHIDROLÓGICO PRELIMINAR EN LA ZONA DE SANDÍA TANQUECILLOS, EN EL ESTADO DE NUEVO LEÓN.
","ESTUDIO GEOHIDROLÓGICO PRELIMINAR EN LA ZONA DE SANDÍA TANQUECILLOS, EN EL ESTADO DE NUEVO LEÓN.
","SERVICIOS GEOLÓGICOS, SOCIEDAD ANÓNIMA",SECRETARÍA DE AGRICULTURA Y RECURSOS HIDRÁULICOS (SARH),,2,1,https://sigagis.conagua.gob.mx/t_estudios24/INVENTARIO/19 NUEVO LEÓN/PDF/0718_CC.pdf,https://sigagis.conagua.gob.mx/t_estudios24/INVENTARIO/19 NUEVO LEÓN/PDF/0718_EC.pdf,NUEVO LEÓN
719,DIGITAL,1981,NUEVO LEÓN,"POZOS DE LOS MUNICIPIOS DE CIUDAD GUADALUPE Y VILLA DE JUÁREZ, ESTADO DE NUEVO LEÓN.","POZOS DE LOS MUNICIPIOS DE CIUDAD GUADALUPE Y VILLA DE JUÁREZ, ESTADO DE NUEVO LEÓN.",,SECRETARÍA DE RECURSOS HIDRÁULICOS (SRH),,1,1,,https://sigagis.conagua.gob.mx/t_estudios24/INVENTARIO/19 NUEVO LEÓN/PDF/0719_EC.pdf,NUEVO LEÓN
721,AMBOS,1980,OAXACA,"ESTUDIO DE LAS CONDICIONES GEOHIDROLÓGICAS DEL VALLE DE TLACOLULA Y ALREDEDORES, EDO. DE OAXACA.
","ESTUDIO DE LAS CONDICIONES GEOHIDROLÓGICAS DEL VALLE DE TLACOLULA Y ALREDEDORES, EDO. DE OAXACA.
","GEOCA, SOCIEDAD ANÓNIMA",SECRETARÍA DE AGRICULTURA Y RECURSOS HIDRÁULICOS (SARH),GZA-79-56-ED,1,3,https://sigagis.conagua.gob.mx/t_estudios24/INVENTARIO/20 OAXACA/PDF/0721_CC.pdf,https://sigagis.conagua.gob.mx/t_estudios24/INVENTARIO/20 OAXACA/PDF/0721_EC.pdf,OAXACA
722,AMBOS,1977,OAXACA,SERVICIOS DE PROSPECCIÓN Y LEVANTAMIENTO GEOLÓGICOS Y GEOFÍSICOS EN EL ESTADO DE OAXACA.,SERVICIOS DE PROSPECCIÓN Y LEVANTAMIENTO GEOLÓGICOS Y GEOFÍSICOS EN EL ESTADO DE OAXACA.,"GEOHIDROLOGÍA MEXICANA, SOCIEDAD ANÓNIMA",SECRETARÍA DE AGRICULTURA Y RECURSOS HIDRÁULICOS (SARH),GZA-77-24-E,1,1,https://sigagis.conagua.gob.mx/t_estudios24/INVENTARIO/20 OAXACA/PDF/0722_CC.pdf,https://sigagis.conagua.gob.mx/t_estudios24/INVENTARIO/20 OAXACA/PDF/0722_EC.pdf,OAXACA
723,AMBOS,1981,OAXACA,"CONDICIONES GEOHIDROLÓGICAS EN DIVERSOS VALLES DEL ESTADO DE QUERÉTARO
RECOMENDACIONES PARA LA EXPLOTACIÓN DE AGUAS SUBTERRÁNEAS","SERVICIOS DE PROSPECCIÓN GEOLÓGICOS Y GEOFÍSICOS EN LA ZONA DE MATÍAS ROMERO-NIZANDA, EN LA PORCIÓN ORIENTAL DEL ESTADO DE OAXACA.
","PERFORACIONES Y ESTUDIOS GEOLÓGICOS, SOCIEDAD ANÓNIMA (PEGSA)",SECRETARÍA DE AGRICULTURA Y RECURSOS HIDRÁULICOS (SARH),GZA-81-19-ED,1,1,https://sigagis.conagua.gob.mx/t_estudios24/INVENTARIO/20 OAXACA/PDF/0723_CC.pdf,https://sigagis.conagua.gob.mx/t_estudios24/INVENTARIO/20 OAXACA/PDF/0723_CC.pdf,OAXACA
724,AMBOS,1984,OAXACA,"ESTUDIO GEOHIDROLÓGICO PRELIMINAR DE LA ZONA MIXTECA- OAXAQUEÑA, ESTADO DE OAXACA
","ESTUDIO GEOHIDROLÓGICO PRELIMINAR DE LA ZONA MIXTECA- OAXAQUEÑA, ESTADO DE OAXACA
","ICATEC, SOCIEDAD ANÓNIMA CONSULTORES",SECRETARÍA DE AGRICULTURA Y RECURSOS HIDRÁULICOS (SARH),AHGZA-83-25-EG,1,2,https://sigagis.conagua.gob.mx/t_estudios24/INVENTARIO/20 OAXACA/PDF/0724_CC.pdf,https://sigagis.conagua.gob.mx/t_estudios24/INVENTARIO/20 OAXACA/PDF/0724_CC.pdf,OAXACA
725,AMBOS,1984,OAXACA,"ESTUDIO GEOFÍSICO COMPLEMENTARIO DE LA ZONA DE NOCHIXTLÁN, PARA PROPORCIÓNAR AGUA EN BLOQUE A LA CIUDAD DE OAXACA, OAX
","ESTUDIO GEOFÍSICO COMPLEMENTARIO DE LA ZONA DE NOCHIXTLÁN, PARA PROPORCIÓNAR AGUA EN BLOQUE A LA CIUDAD DE OAXACA, OAXACA","INGENIEROS GEOFÍSICOS ASOCIADOS, SOCIEDAD CIVIL",SECRETARÍA DE AGRICULTURA Y RECURSOS HIDRÁULICOS (SARH),CC-84-313-D,"2 DE TOMO 1, 1 DEL TOMO 2",2,https://sigagis.conagua.gob.mx/t_estudios24/INVENTARIO/20 OAXACA/PDF/0725_CC.pdf,https://sigagis.conagua.gob.mx/t_estudios24/INVENTARIO/20 OAXACA/PDF/0725_EC.pdf,OAXACA
729,AMBOS,1984,OAXACA,"ESTUDIO GEOHIDROLÓGICO PRELIMINAR EN LA ZONA VALLE DE ETLA, EN EL ESTADO DE OAXACA","ESTUDIO GEOHIDROLÓGICO PRELIMINAR EN LA ZONA VALLE DE ETLA, EN EL ESTADO DE OAXACA","TÉCNICOS ASESORES Y CONSTRUCTORES, SOCIEDAD ANÓNIMA (TACSA)",SECRETARÍA DE AGRICULTURA Y RECURSOS HIDRÁULICOS (SARH),AHGZA-83-22-EG,1,1,https://sigagis.conagua.gob.mx/t_estudios24/INVENTARIO/20 OAXACA/PDF/0729_CC.pdf,https://sigagis.conagua.gob.mx/t_estudios24/INVENTARIO/20 OAXACA/PDF/0729_EC.pdf,OAXACA
730,AMBOS,1984,OAXACA,"ESTUDIO EVALUACIÓN DEL VALLE DE ""ZIMATLÁN"", ESTADO DE OAXACA.","ESTUDIO EVALUACIÓN DEL VALLE DE ""ZIMATLÁN"", ESTADO DE OAXACA.","TÉCNICOS ASESORES Y CONSTRUCTORES, SOCIEDAD ANÓNIMA (TACSA)",SECRETARÍA DE AGRICULTURA Y RECURSOS HIDRÁULICOS (SARH),AHGZA-83-24-EG,1,1,https://sigagis.conagua.gob.mx/t_estudios24/INVENTARIO/20 OAXACA/PDF/0730_CC.pdf,https://sigagis.conagua.gob.mx/t_estudios24/INVENTARIO/20 OAXACA/PDF/0730_EC.pdf,OAXACA
731,AMBOS,1971,OAXACA,POZOS DE EXPLORACIÓN TERMINADOS EN EL VALLE DE ZIMATLÁN,POZOS DE EXPLORACIÓN TERMINADOS EN EL VALLE DE ZIMATLÁN,,COMISIÓN NACIONAL DEL AGUA (CONAGUA),,1,1,https://sigagis.conagua.gob.mx/t_estudios24/INVENTARIO/20 OAXACA/PDF/0731_CC.pdf,https://sigagis.conagua.gob.mx/t_estudios24/INVENTARIO/20 OAXACA/PDF/0731_EC.pdf,OAXACA
732,DIGITAL,1960,OAXACA,"COMUNICACIÓN INTEROCEÁNICA A TRAVÉS DEL ISTMO DE TEHUANTEPEC
ESTUDIO PRELIMINAR","COMUNICACIÓN INTEROCEÁNICA A TRAVÉS DEL ISTMO DE TEHUANTEPEC
ESTUDIO PRELIMINAR",,PETRÓLEOS MEXICANOS (PEMEX),,1,1,,https://sigagis.conagua.gob.mx/t_estudios24/INVENTARIO/20 OAXACA/PDF/0732_EC.pdf,OAXACA
733,AMBOS,1976,OAXACA,"ESTUDIO GEOHIDROLÓGICO DEL SUBÁLVEO DEL RÍO TEHUANTEPEC, EDO. DE OAXACA.","ESTUDIO GEOHIDROLÓGICO DEL SUBÁLVEO DEL RÍO TEHUANTEPEC, EDO. DE OAXACA.","ESTUDIOS GEOLÓGICOS Y OBRAS CIVILES, SOCIEDAD ANÓNIMA (EGEOCISA)",PETRÓLEOS MEXICANOS (PEMEX),GPC-219/75,1,1,https://sigagis.conagua.gob.mx/t_estudios24/INVENTARIO/20 OAXACA/PDF/0733_CC.pdf,https://sigagis.conagua.gob.mx/t_estudios24/INVENTARIO/20 OAXACA/PDF/0733_EC.pdf,OAXACA
734,AMBOS,1979,OAXACA,"ESTUDIO PARA DETERMINAR LAS FUENTES RECOMENDABLES PARA EL ABASTECIMIENTO DE AGUA POTABLE DE LA CIUDAD DE OAXACA
","ESTUDIO PARA DETERMINAR LAS FUENTES RECOMENDABLES PARA EL ABASTECIMIENTO DE AGUA POTABLE DE LA CIUDAD DE OAXACA
","PROYESCO, SOCIEDAD ANÓNIMA",GOBIERNO DEL ESTADO DE OAXACA,BIOU-008-08-78,1,1,https://sigagis.conagua.gob.mx/t_estudios24/INVENTARIO/20 OAXACA/PDF/0734_CC.pdf,https://sigagis.conagua.gob.mx/t_estudios24/INVENTARIO/20 OAXACA/PDF/0734_EC.pdf,OAXACA
735,AMBOS,1977,OAXACA,"INFORME FINAL DEL ESTUDIO GEOHIDROLÓGICO DE EVALUACIÓN Y CENSO EN EL VALLE DE MIAHUATLÁN, EDO. DE OAXACA.
","INFORME FINAL DEL ESTUDIO GEOHIDROLÓGICO DE EVALUACIÓN Y CENSO EN EL VALLE DE MIAHUATLÁN, EDO. DE OAXACA.
","CONSTRUCCIONES, ASESORÍAS Y ESTUDIOS, SOCIEDAD ANÓNIMA",SECRETARÍA DE AGRICULTURA Y RECURSOS HIDRÁULICOS (SARH),EIGZA-77-82 G,1,1,https://sigagis.conagua.gob.mx/t_estudios24/INVENTARIO/20 OAXACA/PDF/0735_CC.pdf,https://sigagis.conagua.gob.mx/t_estudios24/INVENTARIO/20 OAXACA/PDF/0735_EC.pdf,OAXACA
737,DIGITAL,1980,OAXACA,"ESTUDIO GEOHIDROLÓGICO PRELIMINAR DE LA ZONA DE JAMILTEPEC, OAXACA","ESTUDIO GEOHIDROLÓGICO PRELIMINAR DE LA ZONA DE JAMILTEPEC, OAXACA","ROCHA Y ASOCIADOS, SOCIEDAD ANÓNIMA (ROASA)",SECRETARÍA DE AGRICULTURA Y RECURSOS HIDRÁULICOS (SARH),GZA-80-18-GD,1,1,,https://sigagis.conagua.gob.mx/t_estudios24/INVENTARIO/20 OAXACA/PDF/0737_EC.pdf,OAXACA
739,FÍSICO,1980,MORELOS,"ESTUDIO GEOHIDROLÓGICO DE EVALUACIÓN PRELIMINAR DE LAS ZONAS TEPALCINGO- AXOCHIAPAN, EN EL ESTADO DE MORELOS","ESTUDIO GEOHIDROLÓGICO DE EVALUACIÓN PRELIMINAR DE LAS ZONAS TEPALCINGO- AXOCHIAPAN, EN EL ESTADO DE MORELOS","TÉCNICOS ASESORES Y CONSTRUCTORES, SOCIEDAD ANÓNIMA (TACSA)",SECRETARÍA DE AGRICULTURA Y RECURSOS HIDRÁULICOS (SARH),RGZA-79-1,1,1,https://sigagis.conagua.gob.mx/t_estudios24/INVENTARIO/17 MORELOS/PDF/0739_CC.pdf,,MORELOS
740,AMBOS,1996,MORELOS,"ESTUDIO GEOHIDROLÓGICO DE LA ZONA CUAUTLA-YAUTEPEC, MORELOS.
","ESTUDIO GEOHIDROLÓGICO DE LA ZONA CUAUTLA-YAUTEPEC, MORELOS.
","INRI, SOCIEDAD ANÓNIMA",COMISIÓN NACIONAL DEL AGUA (CONAGUA),GAS-004-96,1,1,https://sigagis.conagua.gob.mx/t_estudios24/INVENTARIO/17 MORELOS/PDF/0740_CC.pdf,https://sigagis.conagua.gob.mx/t_estudios24/INVENTARIO/17 MORELOS/PDF/0740_EC.pdf,MORELOS
741,AMBOS,1984,OAXACA,"ESTUDIO GEOHIDROLÓGICO PRELIMINAR EN LA ZONA VALLE DE TLACOLULA, EN EL ESTADO DE OAXACA.","ESTUDIO GEOHIDROLÓGICO PRELIMINAR EN LA ZONA VALLE DE TLACOLULA, EN EL ESTADO DE OAXACA.","TÉCNICOS ASESORES Y CONSTRUCTORES, SOCIEDAD ANÓNIMA (TACSA)",SECRETARÍA DE AGRICULTURA Y RECURSOS HIDRÁULICOS (SARH),AHGZA-83-23-EG,1,1,https://sigagis.conagua.gob.mx/t_estudios24/INVENTARIO/20 OAXACA/PDF/0741_CC.pdf,https://sigagis.conagua.gob.mx/t_estudios24/INVENTARIO/20 OAXACA/PDF/0741_EC.pdf,OAXACA
742,AMBOS,1985,OAXACA,"ESTUDIO DE PROSPECCIÓN DE AGUA SUBTERRÁNEA EN SUBÁLVEOS DE LOS RÍOS MIXTECO XATAN Y ARROYO SECO PARA ABASTECIMIENTO DE AGUA EN BLOQUE A LA CIUDAD DE HUAJUAPAN DE LEÓN, EDO. DE OAXACA.","ESTUDIO DE PROSPECCIÓN DE AGUA SUBTERRÁNEA EN SUBÁLVEOS DE LOS RÍOS MIXTECO XATAN Y ARROYO SECO PARA ABASTECIMIENTO DE AGUA EN BLOQUE A LA CIUDAD DE HUAJUAPAN DE LEÓN, EDO. DE OAXACA.","INGENIEROS GEOFÍSICOS ASOCIADOS, SOCIEDAD CIVIL",SECRETARÍA DE AGRICULTURA Y RECURSOS HIDRÁULICOS (SARH),CC-84-322-D,1,2,https://sigagis.conagua.gob.mx/t_estudios24/INVENTARIO/20 OAXACA/PDF/0742_CC.pdf,https://sigagis.conagua.gob.mx/t_estudios24/INVENTARIO/20 OAXACA/PDF/0742_EC.pdf,OAXACA
743,AMBOS,1984,GUERRERO OAXACA,"ESTUDIO GEOLÓGICO Y EVALUACIÓN CUALITATIVA DEL POTENCIAL GEOHIDROLÓGICO DEL ÁREA DE TLAPA-XALPATLÁHUAC-ALCOZAUCA, EDOS. DE GUERRERO Y OAXACA","ESTUDIO GEOLÓGICO Y EVALUACIÓN CUALITATIVA DEL POTENCIAL GEOHIDROLÓGICO DEL ÁREA DE TLAPA-XALPATLÁHUAC-ALCOZAUCA, EDOS. DE GUERRERO Y OAXACA","ESTUDIOS GEOLÓGICOS DE MÉXICO, SOCIEDAD ANÓNIMA DE CAPITAL VARIABLE",SECRETARÍA DE AGRICULTURA Y RECURSOS HIDRÁULICOS (SARH),AH-GZA-83-3-FG,1,1,https://sigagis.conagua.gob.mx/t_estudios24/INVENTARIO/20 OAXACA/PDF/0743_CC.pdf,https://sigagis.conagua.gob.mx/t_estudios24/INVENTARIO/20 OAXACA/PDF/0743_EC.pdf,OAXACA
744,FÍSICO,2000,CHIHUAHUA,"ESTUDIO GEOHIDROLÓGICO DEL ACUÍFERO CASAS GRANDES, ESTADO DE CHIHUAHUA","ESTUDIO GEOHIDROLÓGICO DEL ACUÍFERO CASAS GRANDES, ESTADO DE CHIHUAHUA",COMISIÓN NACIONAL DEL AGUA (CONAGUA),COMISIÓN NACIONAL DEL AGUA (CONAGUA),INFORME TÉCNICO GAS/2000/3,1,1,https://sigagis.conagua.gob.mx/t_estudios24/INVENTARIO/08 CHIHUAHUA/PDF/0744_CC.pdf,,CHIHUAHUA
